category,paper_id,title,link,summary
cs.CL,cs.CL_152,Telling Speculative Stories to Help Humans Imagine the Harms of Healthcare AI,https://arxiv.org/abs/2510.14718,"arXiv:2510.14718v3 Announce Type: replace 
Abstract: Artificial intelligence (AI) is rapidly transforming healthcare, enabling fast development of tools like stress monitors, wellness trackers, and me"
cs.CL,cs.CL_153,Contrastive Decoding Mitigates Score Range Bias in LLM-as-a-Judge,https://arxiv.org/abs/2510.18196,"arXiv:2510.18196v2 Announce Type: replace 
Abstract: Large Language Models (LLMs) are commonly used as evaluators in various applications, but the reliability of the outcomes remains a challenge. One "
cs.CL,cs.CL_154,How to Evaluate Speech Translation with Source-Aware Neural MT Metrics,https://arxiv.org/abs/2511.03295,"arXiv:2511.03295v3 Announce Type: replace 
Abstract: Automatic evaluation of ST systems is typically performed by comparing translation hypotheses with one or more reference translations. While effect"
cs.CL,cs.CL_155,Rectifying LLM Thought from Lens of Optimization,https://arxiv.org/abs/2512.01925,"arXiv:2512.01925v2 Announce Type: replace 
Abstract: Recent advancements in large language models (LLMs) have been driven by their emergent reasoning capabilities, particularly through long chain-of-t"
cs.CL,cs.CL_156,ADOPT: Adaptive Dependency-Guided Joint Prompt Optimization for Multi-Step LLM Pipelines,https://arxiv.org/abs/2512.24933,"arXiv:2512.24933v2 Announce Type: replace 
Abstract: Multi-step LLM pipelines can solve complex tasks, but jointly optimizing prompts across steps remains challenging due to missing step-level supervi"
cs.CL,cs.CL_157,Improved Evidence Extraction and Metrics for Document Inconsistency Detection with LLMs,https://arxiv.org/abs/2601.02627,"arXiv:2601.02627v2 Announce Type: replace 
Abstract: Large language models (LLMs) are becoming useful in many domains due to their impressive abilities that arise from large training datasets and larg"
cs.CL,cs.CL_158,Enhancing Multilingual RAG Systems with Debiased Language Preference-Guided Query Fusion,https://arxiv.org/abs/2601.02956,"arXiv:2601.02956v2 Announce Type: replace 
Abstract: Multilingual Retrieval-Augmented Generation (mRAG) systems often exhibit a perceived preference for high-resource languages, particularly English, "
cs.CL,cs.CL_159,Is Sentiment Banana-Shaped? Exploring the Geometry and Portability of Sentiment Concept Vectors,https://arxiv.org/abs/2601.07995,"arXiv:2601.07995v2 Announce Type: replace 
Abstract: Use cases of sentiment analysis in the humanities often require contextualized, continuous scores. Concept Vector Projections (CVP) offer a recent "
cs.CL,cs.CL_160,PEARL: Self-Evolving Assistant for Time Management with Reinforcement Learning,https://arxiv.org/abs/2601.11957,"arXiv:2601.11957v3 Announce Type: replace 
Abstract: Overlapping calendar invitations force busy professionals to repeatedly decide which meetings to attend, reschedule, or decline. We refer to this p"
cs.CL,cs.CL_161,Computer Environments Elicit General Agentic Intelligence in LLMs,https://arxiv.org/abs/2601.16206,"arXiv:2601.16206v3 Announce Type: replace 
Abstract: Agentic intelligence in large language models (LLMs) requires not only model intrinsic capabilities but also interactions with external environment"
cs.CL,cs.CL_162,PACIFIC: Can LLMs Discern the Traits Influencing Your Preferences? Evaluating Personality-Driven Preference Alignment in LLMs,https://arxiv.org/abs/2602.07181,"arXiv:2602.07181v3 Announce Type: replace 
Abstract: User preferences are increasingly used to personalize Large Language Model (LLM) responses, yet how to reliably leverage preference signals for ans"
cs.CL,cs.CL_163,ACE-Merging: Data-Free Model Merging with Adaptive Covariance Estimation,https://arxiv.org/abs/2603.02945,"arXiv:2603.02945v2 Announce Type: replace 
Abstract: Model merging aims to combine multiple task-specific expert models into a single model while preserving generalization across diverse tasks. Howeve"
cs.CL,cs.CL_164,What Do AI Agents Talk About? Discourse and Architectural Constraints in the First AI-Only Social Network,https://arxiv.org/abs/2603.07880,"arXiv:2603.07880v3 Announce Type: replace 
Abstract: Moltbook is the first large-scale social network built for autonomous AI agent-to-agent interaction. Early studies on Moltbook have interpreted its"
cs.CL,cs.CL_165,PEEM: Prompt Engineering Evaluation Metrics for Interpretable Joint Evaluation of Prompts and Responses,https://arxiv.org/abs/2603.10477,"arXiv:2603.10477v2 Announce Type: replace 
Abstract: Prompt design is a primary control interface for large language models (LLMs), yet standard evaluations largely reduce performance to answer correc"
cs.CL,cs.CL_166,Mitigating Hallucination on Hallucination in RAG via Ensemble Voting,https://arxiv.org/abs/2603.27253,"arXiv:2603.27253v2 Announce Type: replace 
Abstract: Retrieval-Augmented Generation (RAG) aims to reduce hallucinations in Large Language Models (LLMs) by integrating external knowledge. However, RAG "
cs.CL,cs.CL_167,A Taxonomy of Programming Languages for Code Generation,https://arxiv.org/abs/2604.00239,"arXiv:2604.00239v2 Announce Type: replace 
Abstract: The world's 7,000+ languages vary widely in the availability of resources for NLP, motivating efforts to systematically categorize them by their de"
cs.CL,cs.CL_168,JoyAI-LLM Flash: Advancing Mid-Scale LLMs with Token Efficiency,https://arxiv.org/abs/2604.03044,"arXiv:2604.03044v2 Announce Type: replace 
Abstract: We introduce JoyAI-LLM Flash, an efficient Mixture-of-Experts (MoE) language model designed to redefine the trade-off between strong performance an"
cs.CL,cs.CL_169,StoryScope: Investigating idiosyncrasies in AI fiction,https://arxiv.org/abs/2604.03136,"arXiv:2604.03136v3 Announce Type: replace 
Abstract: As AI-generated fiction becomes increasingly prevalent, questions of authorship and originality are becoming central to how written work is evaluat"
cs.CL,cs.CL_170,Compressible Softmax-Attended Language under Incompressible Attention,https://arxiv.org/abs/2604.04384,"arXiv:2604.04384v2 Announce Type: replace 
Abstract: Softmax attention defines an interaction through $d_h$ head dimensions, but not all dimensions carry equal weight once real text passes through. We"
cs.CL,cs.CL_171,UI-AGILE: Advancing GUI Agents with Effective Reinforcement Learning and Precise Inference-Time Grounding,https://arxiv.org/abs/2507.22025,"arXiv:2507.22025v4 Announce Type: replace-cross 
Abstract: The emergence of Multimodal Large Language Models (MLLMs) has driven significant advances in Graphical User Interface (GUI) agent capabilitie"
cs.CL,cs.CL_172,One Life to Learn: Inferring Symbolic World Models for Stochastic Environments from Unguided Exploration,https://arxiv.org/abs/2510.12088,"arXiv:2510.12088v2 Announce Type: replace-cross 
Abstract: Symbolic world modeling requires inferring and representing an environment's transitional dynamics as an executable program. Prior work has f"
cs.CL,cs.CL_173,VisCoder2: Building Multi-Language Visualization Coding Agents,https://arxiv.org/abs/2510.23642,"arXiv:2510.23642v2 Announce Type: replace-cross 
Abstract: Large language models (LLMs) have recently enabled coding agents capable of generating, executing, and revising visualization code. However, "
cs.CL,cs.CL_174,GIFT: Group-Relative Implicit Fine-Tuning Integrates GRPO with DPO and UNA,https://arxiv.org/abs/2510.23868,"arXiv:2510.23868v4 Announce Type: replace-cross 
Abstract: This paper proposes \textit{Group-relative Implicit Fine-Tuning (GIFT)}, a reinforcement learning framework for aligning large language model"
cs.CL,cs.CL_175,Graph Representation-based Model Poisoning on the Heterogeneous Internet of Agents,https://arxiv.org/abs/2511.07176,"arXiv:2511.07176v3 Announce Type: replace-cross 
Abstract: Internet of Agents (IoA) envisions a unified, agent-centric paradigm where heterogeneous large language model (LLM) agents can interconnect a"
cs.CL,cs.CL_176,FBS: Modeling Native Parallel Reading inside a Transformer,https://arxiv.org/abs/2601.21708,"arXiv:2601.21708v2 Announce Type: replace-cross 
Abstract: Large language models (LLMs) excel across many tasks, yet inference is still dominated by strictly token-by-token autoregression. Existing ac"
cs.CL,cs.CL_177,Daily and Weekly Periodicity in Large Language Model Performance and Its Implications for Research,https://arxiv.org/abs/2602.15889,"arXiv:2602.15889v2 Announce Type: replace-cross 
Abstract: Large language models (LLMs) are increasingly used in research as both tools and objects of study. Much of this work assumes that LLM perform"
cs.CL,cs.CL_178,"What Makes an Ideal Quote? Recommending ""Unexpected yet Rational"" Quotations via Novelty",https://arxiv.org/abs/2602.22220,"arXiv:2602.22220v2 Announce Type: replace-cross 
Abstract: Quotation recommendation aims to enrich writing by suggesting quotes that complement a given context, yet existing systems mostly optimize su"
cs.CL,cs.CL_179,Self-Distilled RLVR,https://arxiv.org/abs/2604.03128,"arXiv:2604.03128v2 Announce Type: replace-cross 
Abstract: On-policy distillation (OPD) has become a popular training paradigm in the LLM community. This paradigm selects a larger model as the teacher"
cs.CL,cs.CL_180,Region-R1: Reinforcing Query-Side Region Cropping for Multi-Modal Re-Ranking,https://arxiv.org/abs/2604.05268,"arXiv:2604.05268v2 Announce Type: replace-cross 
Abstract: Multi-modal retrieval-augmented generation (MM-RAG) relies heavily on re-rankers to surface the most relevant evidence for image-question que"
cs.CL,cs.CL_181,Bridging Natural Language and Microgrid Dynamics: A Context-Aware Simulator and Dataset,https://arxiv.org/abs/2604.05429,"arXiv:2604.05429v2 Announce Type: replace-cross 
Abstract: Addressing the critical need for intelligent, context-aware energy management in renewable systems, we introduce the OpenCEM Simulator and Da"
cs.CL,cs.CL_182,JU\'A -- A Benchmark for Information Retrieval in Brazilian Legal Text Collections,https://arxiv.org/abs/2604.06098,"arXiv:2604.06098v2 Announce Type: replace-cross 
Abstract: Legal information retrieval in Portuguese remains difficult to evaluate systematically because available datasets differ widely in document t"
