category,paper_id,title,link,summary
cs.CL,cs.CL_76,"To Adapt or not to Adapt, Rethinking the Value of Medical Knowledge-Aware Large Language Models",https://arxiv.org/abs/2604.06854,"arXiv:2604.06854v1 Announce Type: new 
Abstract: BACKGROUND: Recent studies have shown that domain-adapted large language models (LLMs) do not consistently outperform general-purpose counterparts on s"
cs.CL,cs.CL_77,Do We Need Distinct Representations for Every Speech Token? Unveiling and Exploiting Redundancy in Large Speech Language Models,https://arxiv.org/abs/2604.06871,"arXiv:2604.06871v1 Announce Type: new 
Abstract: Large Speech Language Models (LSLMs) typically operate at high token rates (tokens/s) to ensure acoustic fidelity, yet this results in sequence lengths"
cs.CL,cs.CL_78,iTAG: Inverse Design for Natural Text Generation with Accurate Causal Graph Annotations,https://arxiv.org/abs/2604.06902,"arXiv:2604.06902v1 Announce Type: new 
Abstract: A fundamental obstacle to causal discovery from text is the lack of causally annotated text data for use as ground truth, due to high annotation costs."
cs.CL,cs.CL_79,Is Biomedical Specialization Still Worth It? Insights from Domain-Adaptive Language Modelling with a New French Health Corpus,https://arxiv.org/abs/2604.06903,"arXiv:2604.06903v1 Announce Type: new 
Abstract: Large language models (LLMs) have demonstrated remarkable capabilities across diverse domains, yet their adaptation to specialized fields remains chall"
cs.CL,cs.CL_80,"The AI Skills Shift: Mapping Skill Obsolescence, Emergence, and Transition Pathways in the LLM Era",https://arxiv.org/abs/2604.06906,"arXiv:2604.06906v1 Announce Type: new 
Abstract: As Large Language Models reshape the global labor market, policymakers and workers need empirical data on which occupational skills may be most suscept"
cs.CL,cs.CL_81,Self-Preference Bias in Rubric-Based Evaluation of Large Language Models,https://arxiv.org/abs/2604.06996,"arXiv:2604.06996v1 Announce Type: new 
Abstract: LLM-as-a-judge has become the de facto approach for evaluating LLM outputs. However, judges are known to exhibit self-preference bias (SPB): they tend "
cs.CL,cs.CL_82,ChunQiuTR: Time-Keyed Temporal Retrieval in Classical Chinese Annals,https://arxiv.org/abs/2604.06997,"arXiv:2604.06997v1 Announce Type: new 
Abstract: Retrieval shapes how language models access and ground knowledge in retrieval-augmented generation (RAG). In historical research, the target is often n"
cs.CL,cs.CL_83,Continuous Interpretive Steering for Scalar Diversity,https://arxiv.org/abs/2604.07006,"arXiv:2604.07006v1 Announce Type: new 
Abstract: Pragmatic inference is inherently graded. Different lexical items give rise to pragmatic enrichment to different degrees. Scalar implicature exemplifie"
cs.CL,cs.CL_84,DTCRS: Dynamic Tree Construction for Recursive Summarization,https://arxiv.org/abs/2604.07012,"arXiv:2604.07012v1 Announce Type: new 
Abstract: Retrieval-Augmented Generation (RAG) mitigates the hallucination problem of Large Language Models (LLMs) by incorporating external knowledge. Recursive"
cs.CL,cs.CL_85,Corpora deduplication or duplication in Natural Language Processing of few resourced languages ? A case of study: The Mexico's Nahuatl,https://arxiv.org/abs/2604.07015,"arXiv:2604.07015v1 Announce Type: new 
Abstract: In this article, we seek to answer the following question: could data duplication be useful in Natural Language Processing (NLP) for languages with lim"
cs.CL,cs.CL_86,MARS: Enabling Autoregressive Models Multi-Token Generation,https://arxiv.org/abs/2604.07023,"arXiv:2604.07023v1 Announce Type: new 
Abstract: Autoregressive (AR) language models generate text one token at a time, even when consecutive tokens are highly predictable given earlier context. We in"
cs.CL,cs.CL_87,"Gemma 4, Phi-4, and Qwen3: Accuracy-Efficiency Tradeoffs in Dense and MoE Reasoning Language Models",https://arxiv.org/abs/2604.07035,"arXiv:2604.07035v1 Announce Type: new 
Abstract: Mixture-of-experts (MoE) language models are often expected to offer better quality-efficiency tradeoffs than dense models because only a subset of par"
cs.CL,cs.CL_88,ReDAct: Uncertainty-Aware Deferral for LLM Agents,https://arxiv.org/abs/2604.07036,"arXiv:2604.07036v1 Announce Type: new 
Abstract: Recently, LLM-based agents have become increasingly popular across many applications, including complex sequential decision-making problems. However, t"
cs.CL,cs.CL_89,"Sell More, Play Less: Benchmarking LLM Realistic Selling Skill",https://arxiv.org/abs/2604.07054,"arXiv:2604.07054v1 Announce Type: new 
Abstract: Sales dialogues require multi-turn, goal-directed persuasion under asymmetric incentives, which makes them a challenging setting for large language mod"
cs.CL,cs.CL_90,IndoBERT-Sentiment: Context-Conditioned Sentiment Classification for Indonesian Text,https://arxiv.org/abs/2604.07057,"arXiv:2604.07057v1 Announce Type: new 
Abstract: Existing Indonesian sentiment analysis models classify text in isolation, ignoring the topical context that often determines whether a statement is pos"
cs.CL,cs.CL_91,SemEval-2026 Task 3: Dimensional Aspect-Based Sentiment Analysis (DimABSA),https://arxiv.org/abs/2604.07066,"arXiv:2604.07066v1 Announce Type: new 
Abstract: We present the SemEval-2026 shared task on Dimensional Aspect-Based Sentiment Analysis (DimABSA), which improves traditional ABSA by modeling sentiment"
cs.CL,cs.CL_92,Is Cross-Lingual Transfer in Bilingual Models Human-Like? A Study with Overlapping Word Forms in Dutch and English,https://arxiv.org/abs/2604.07067,"arXiv:2604.07067v1 Announce Type: new 
Abstract: Bilingual speakers show cross-lingual activation during reading, especially for words with shared surface form. Cognates (friends) typically lead to fa"
cs.CL,cs.CL_93,Multilingual Embedding Probes Fail to Generalize Across Learner Corpora,https://arxiv.org/abs/2604.07095,"arXiv:2604.07095v1 Announce Type: new 
Abstract: Do multilingual embedding models encode a language-general representation of proficiency? We investigate this by training linear and non-linear probes "
cs.CL,cs.CL_94,STRIDE-ED: A Strategy-Grounded Stepwise Reasoning Framework for Empathetic Dialogue Systems,https://arxiv.org/abs/2604.07100,"arXiv:2604.07100v1 Announce Type: new 
Abstract: Empathetic dialogue requires not only recognizing a user's emotional state but also making strategy-aware, context-sensitive decisions throughout respo"
cs.CL,cs.CL_95,The Impact of Steering Large Language Models with Persona Vectors in Educational Applications,https://arxiv.org/abs/2604.07102,"arXiv:2604.07102v1 Announce Type: new 
Abstract: Activation-based steering can personalize large language models at inference time, but its effects in educational settings remain unclear. We study per"
cs.CL,cs.CL_96,Yale-DM-Lab at ArchEHR-QA 2026: Deterministic Grounding and Multi-Pass Evidence Alignment for EHR Question Answering,https://arxiv.org/abs/2604.07116,"arXiv:2604.07116v1 Announce Type: new 
Abstract: We describe the Yale-DM-Lab system for the ArchEHR-QA 2026 shared task. The task studies patient-authored questions about hospitalization records and c"
cs.CL,cs.CL_97,Are Non-English Papers Reviewed Fairly? Language-of-Study Bias in NLP Peer Reviews,https://arxiv.org/abs/2604.07119,"arXiv:2604.07119v1 Announce Type: new 
Abstract: Peer review plays a central role in the NLP publication process, but is susceptible to various biases. Here, we study language-of-study (LoS) bias: the"
cs.CL,cs.CL_98,Language Bias under Conflicting Information in Multilingual LLMs,https://arxiv.org/abs/2604.07123,"arXiv:2604.07123v1 Announce Type: new 
Abstract: Large Language Models (LLMs) have been shown to contain biases in the process of integrating conflicting information when answering questions. Here we "
cs.CL,cs.CL_99,Dynamic Context Evolution for Scalable Synthetic Data Generation,https://arxiv.org/abs/2604.07147,"arXiv:2604.07147v1 Announce Type: new 
Abstract: Large language models produce repetitive output when prompted independently across many batches, a phenomenon we term cross-batch mode collapse: the pr"
cs.CL,cs.CL_100,Agent-Driven Corpus Linguistics: A Framework for Autonomous Linguistic Discovery,https://arxiv.org/abs/2604.07189,"arXiv:2604.07189v1 Announce Type: new 
Abstract: Corpus linguistics has traditionally relied on human researchers to formulate hypotheses, construct queries, and interpret results - a process demandin"
cs.CL,cs.CL_101,LaScA: Language-Conditioned Scalable Modelling of Affective Dynamics,https://arxiv.org/abs/2604.07193,"arXiv:2604.07193v1 Announce Type: new 
Abstract: Predicting affect in unconstrained environments remains a fundamental challenge in human-centered AI. While deep neural embeddings dominate contemporar"
cs.CL,cs.CL_102,Efficient Learned Data Compression via Dual-Stream Feature Decoupling,https://arxiv.org/abs/2604.07239,"arXiv:2604.07239v1 Announce Type: new 
Abstract: While Learned Data Compression (LDC) has achieved superior compression ratios, balancing precise probability modeling with system efficiency remains ch"
cs.CL,cs.CL_103,Joint Optimization of Reasoning and Dual-Memory for Self-Learning Diagnostic Agent,https://arxiv.org/abs/2604.07269,"arXiv:2604.07269v1 Announce Type: new 
Abstract: Clinical expertise improves not only by acquiring medical knowledge, but by accumulating experience that yields reusable diagnostic patterns. Recent LL"
cs.CL,cs.CL_104,ClickGuard: A Trustworthy Adaptive Fusion Framework for Clickbait Detection,https://arxiv.org/abs/2604.07272,"arXiv:2604.07272v1 Announce Type: new 
Abstract: The widespread use of clickbait headlines, crafted to mislead and maximize engagement, poses a significant challenge to online credibility. These headl"
cs.CL,cs.CL_105,A Systematic Study of Retrieval Pipeline Design for Retrieval-Augmented Medical Question Answering,https://arxiv.org/abs/2604.07274,"arXiv:2604.07274v1 Announce Type: new 
Abstract: Large language models (LLMs) have demonstrated strong capabilities in medical question answering; however, purely parametric models often suffer from k"
cs.CL,cs.CL_106,"Why teaching resists automation in an AI-inundated era: Human judgment, non-modular work, and the limits of delegation",https://arxiv.org/abs/2604.07285,"arXiv:2604.07285v1 Announce Type: new 
Abstract: Debates about artificial intelligence (AI) in education often portray teaching as a modular and procedural job that can increasingly be automated or de"
cs.CL,cs.CL_107,OpenSpatial: A Principled Data Engine for Empowering Spatial Intelligence,https://arxiv.org/abs/2604.07296,"arXiv:2604.07296v1 Announce Type: new 
Abstract: Spatial understanding is a fundamental cornerstone of human-level intelligence. Nonetheless, current research predominantly focuses on domain-specific "
cs.CL,cs.CL_108,Evaluating In-Context Translation with Synchronous Context-Free Grammar Transduction,https://arxiv.org/abs/2604.07320,"arXiv:2604.07320v1 Announce Type: new 
Abstract: Low-resource languages pose a challenge for machine translation with large language models (LLMs), which require large amounts of training data. One po"
cs.CL,cs.CL_109,Personalized RewardBench: Evaluating Reward Models with Human Aligned Personalization,https://arxiv.org/abs/2604.07343,"arXiv:2604.07343v1 Announce Type: new 
Abstract: Pluralistic alignment has emerged as a critical frontier in the development of Large Language Models (LLMs), with reward models (RMs) serving as a cent"
cs.CL,cs.CL_110,Robustness Risk of Conversational Retrieval: Identifying and Mitigating Noise Sensitivity in Qwen3-Embedding Model,https://arxiv.org/abs/2604.06176,"arXiv:2604.06176v1 Announce Type: cross 
Abstract: We present an empirical study of embedding-based retrieval under realistic conversational settings, where queries are short, dialogue-like, and weakl"
cs.CL,cs.CL_111,WebExpert: domain-aware web agents with critic-guided expert experience for high-precision search,https://arxiv.org/abs/2604.06177,"arXiv:2604.06177v1 Announce Type: cross 
Abstract: Specialized web tasks in finance, biomedicine, and pharmaceuticals remain challenging due to missing domain priors: queries drift, evidence is noisy,"
cs.CL,cs.CL_112,ARIA: Adaptive Retrieval Intelligence Assistant -- A Multimodal RAG Framework for Domain-Specific Engineering Education,https://arxiv.org/abs/2604.06179,"arXiv:2604.06179v1 Announce Type: cross 
Abstract: Developing effective, domain-specific educational support systems is central to advancing AI in education. Although large language models (LLMs) demo"
cs.CL,cs.CL_113,Benchmarking LLM Tool-Use in the Wild,https://arxiv.org/abs/2604.06185,"arXiv:2604.06185v1 Announce Type: cross 
Abstract: Fulfilling user needs through Large Language Model multi-turn, multi-step tool-use is rarely a straightforward process. Real user interactions are in"
cs.CL,cs.CL_114,LLM Spirals of Delusion: A Benchmarking Audit Study of AI Chatbot Interfaces,https://arxiv.org/abs/2604.06188,"arXiv:2604.06188v1 Announce Type: cross 
Abstract: People increasingly hold sustained, open-ended conversations with large language models (LLMs). Public reports and early studies suggest that, in suc"
cs.CL,cs.CL_115,Harf-Speech: A Clinically Aligned Framework for Arabic Phoneme-Level Speech Assessment,https://arxiv.org/abs/2604.06191,"arXiv:2604.06191v1 Announce Type: cross 
Abstract: Automated phoneme-level pronunciation assessment is vital for scalable speech therapy and language learning, yet validated tools for Arabic remain sc"
cs.CL,cs.CL_116,The Human Condition as Reflected in Contemporary Large Language Models,https://arxiv.org/abs/2604.06206,"arXiv:2604.06206v1 Announce Type: cross 
Abstract: This study seeks to uncover evidence of a latent structure in evolved human culture as it is refracted through contemporary large language models (LL"
cs.CL,cs.CL_117,Code Sharing In Prediction Model Research: A Scoping Review,https://arxiv.org/abs/2604.06212,"arXiv:2604.06212v1 Announce Type: cross 
Abstract: Analytical code is essential for reproducing diagnostic and prognostic prediction model research, yet code availability in the published literature r"
cs.CL,cs.CL_118,"Probabilistic Language Tries: A Unified Framework for Compression, Decision Policies, and Execution Reuse",https://arxiv.org/abs/2604.06228,"arXiv:2604.06228v1 Announce Type: cross 
Abstract: We introduce probabilistic language tries (PLTs), a unified representation that makes explicit the prefix structure implicitly defined by any generat"
cs.CL,cs.CL_119,Automating Database-Native Function Code Synthesis with LLMs,https://arxiv.org/abs/2604.06231,"arXiv:2604.06231v1 Announce Type: cross 
Abstract: Database systems incorporate an ever-growing number of functions in their kernels (a.k.a., database native functions) for scenarios like new applicat"
cs.CL,cs.CL_120,Weakly Supervised Distillation of Hallucination Signals into Transformer Representations,https://arxiv.org/abs/2604.06277,"arXiv:2604.06277v1 Announce Type: cross 
Abstract: Existing hallucination detection methods for large language models (LLMs) rely on external verification at inference time, requiring gold answers, re"
cs.CL,cs.CL_121,Say Something Else: Rethinking Contextual Privacy as Information Sufficiency,https://arxiv.org/abs/2604.06409,"arXiv:2604.06409v1 Announce Type: cross 
Abstract: LLM agents increasingly draft messages on behalf of users, yet users routinely overshare sensitive information and disagree on what counts as private"
cs.CL,cs.CL_122,The Depth Ceiling: On the Limits of Large Language Models in Discovering Latent Planning,https://arxiv.org/abs/2604.06427,"arXiv:2604.06427v1 Announce Type: cross 
Abstract: The viability of chain-of-thought (CoT) monitoring hinges on models being unable to reason effectively in their latent representations. Yet little is"
cs.CL,cs.CL_123,"Transformer See, Transformer Do: Copying as an Intermediate Step in Learning Analogical Reasoning",https://arxiv.org/abs/2604.06501,"arXiv:2604.06501v1 Announce Type: cross 
Abstract: Analogical reasoning is a hallmark of human intelligence, enabling us to solve new problems by transferring knowledge from one situation to another. "
cs.CL,cs.CL_124,Argus: Reorchestrating Static Analysis via a Multi-Agent Ensemble for Full-Chain Security Vulnerability Detection,https://arxiv.org/abs/2604.06633,"arXiv:2604.06633v1 Announce Type: cross 
Abstract: Recent advancements in Large Language Models (LLMs) have sparked interest in their application to Static Application Security Testing (SAST), primari"
cs.CL,cs.CL_125,SHAPE: Stage-aware Hierarchical Advantage via Potential Estimation for LLM Reasoning,https://arxiv.org/abs/2604.06636,"arXiv:2604.06636v1 Announce Type: cross 
Abstract: Process supervision has emerged as a promising approach for enhancing LLM reasoning, yet existing methods fail to distinguish meaningful progress fro"
cs.CL,cs.CL_126,Specializing Large Models for Oracle Bone Script Interpretation via Component-Grounded Multimodal Knowledge Augmentation,https://arxiv.org/abs/2604.06711,"arXiv:2604.06711v1 Announce Type: cross 
Abstract: Deciphering ancient Chinese Oracle Bone Script (OBS) is a challenging task that offers insights into the beliefs, systems, and culture of the ancient"
cs.CL,cs.CL_127,Steering the Verifiability of Multimodal AI Hallucinations,https://arxiv.org/abs/2604.06714,"arXiv:2604.06714v1 Announce Type: cross 
Abstract: AI applications driven by multimodal large language models (MLLMs) are prone to hallucinations and pose considerable risks to human users. Crucially,"
cs.CL,cs.CL_128,Geometric Properties of the Voronoi Tessellation in Latent Semantic Manifolds of Large Language Models,https://arxiv.org/abs/2604.06767,"arXiv:2604.06767v1 Announce Type: cross 
Abstract: Language models operate on discrete tokens but compute in continuous vector spaces, inducing a Voronoi tessellation over the representation manifold."
cs.CL,cs.CL_129,From Perception to Autonomous Computational Modeling: A Multi-Agent Approach,https://arxiv.org/abs/2604.06788,"arXiv:2604.06788v1 Announce Type: cross 
Abstract: We present a solver-agnostic framework in which coordinated large language model (LLM) agents autonomously execute the complete computational mechani"
cs.CL,cs.CL_130,Video-guided Machine Translation with Global Video Context,https://arxiv.org/abs/2604.06789,"arXiv:2604.06789v1 Announce Type: cross 
Abstract: Video-guided Multimodal Translation (VMT) has advanced significantly in recent years. However, most existing methods rely on locally aligned video se"
cs.CL,cs.CL_131,"Digital Skin, Digital Bias: Uncovering Tone-Based Biases in LLMs and Emoji Embeddings",https://arxiv.org/abs/2604.06863,"arXiv:2604.06863v1 Announce Type: cross 
Abstract: Skin-toned emojis are crucial for fostering personal identity and social inclusion in online communication. As AI models, particularly Large Language"
cs.CL,cs.CL_132,Strategic Persuasion with Trait-Conditioned Multi-Agent Systems for Iterative Legal Argumentation,https://arxiv.org/abs/2604.07028,"arXiv:2604.07028v1 Announce Type: cross 
Abstract: Strategic interaction in adversarial domains such as law, diplomacy, and negotiation is mediated by language, yet most game-theoretic models abstract"
cs.CL,cs.CL_133,Selective Neuron Amplification for Training-Free Task Enhancement,https://arxiv.org/abs/2604.07098,"arXiv:2604.07098v1 Announce Type: cross 
Abstract: Large language models often fail on tasks they seem to already understand. In our experiments, this appears to be less about missing knowledge and mo"
cs.CL,cs.CL_134,TraceSafe: A Systematic Assessment of LLM Guardrails on Multi-Step Tool-Calling Trajectories,https://arxiv.org/abs/2604.07223,"arXiv:2604.07223v1 Announce Type: cross 
Abstract: As large language models (LLMs) evolve from static chatbots into autonomous agents, the primary vulnerability surface shifts from final outputs to in"
cs.CL,cs.CL_135,How Much LLM Does a Self-Revising Agent Actually Need?,https://arxiv.org/abs/2604.07236,"arXiv:2604.07236v1 Announce Type: cross 
Abstract: Recent LLM-based agents often place world modeling, planning, and reflection inside a single language model loop. This can produce capable behavior, "
cs.CL,cs.CL_136,On the Price of Privacy for Language Identification and Generation,https://arxiv.org/abs/2604.07238,"arXiv:2604.07238v1 Announce Type: cross 
Abstract: As large language models (LLMs) are increasingly trained on sensitive user data, understanding the fundamental cost of privacy in language learning b"
cs.CL,cs.CL_137,Appear2Meaning: A Cross-Cultural Benchmark for Structured Cultural Metadata Inference from Images,https://arxiv.org/abs/2604.07338,"arXiv:2604.07338v1 Announce Type: cross 
Abstract: Recent advances in vision-language models (VLMs) have improved image captioning for cultural heritage. However, inferring structured cultural metadat"
cs.CL,cs.CL_138,A Multilingual Dataset and Empirical Validation for the Mutual Reinforcement Effect in Information Extraction,https://arxiv.org/abs/2407.10953,"arXiv:2407.10953v4 Announce Type: replace 
Abstract: The Mutual Reinforcement Effect (MRE) describes a phenomenon in information extraction where word-level and sentence-level tasks can mutually impro"
cs.CL,cs.CL_139,Reinforcement Learning for LLM Post-Training: A Survey,https://arxiv.org/abs/2407.16216,"arXiv:2407.16216v2 Announce Type: replace 
Abstract: Through pretraining and supervised fine-tuning (SFT), large language models (LLMs) acquire strong instruction-following capabilities, yet they can "
cs.CL,cs.CL_140,Exploring Natural Language-Based Strategies for Efficient Number Learning in Children through Reinforcement Learning,https://arxiv.org/abs/2410.08334,"arXiv:2410.08334v2 Announce Type: replace 
Abstract: In this paper, we build a reinforcement learning framework to study how children compose numbers using base-ten blocks. Studying numerical cognitio"
cs.CL,cs.CL_141,SimSiam Naming Game: A Unified Approach for Representation Learning and Emergent Communication,https://arxiv.org/abs/2410.21803,"arXiv:2410.21803v2 Announce Type: replace 
Abstract: Emergent Communication (EmCom) investigates how agents develop symbolic communication through interaction without predefined language. Recent frame"
cs.CL,cs.CL_142,LongSpec: Long-Context Lossless Speculative Decoding with Efficient Drafting and Verification,https://arxiv.org/abs/2502.17421,"arXiv:2502.17421v4 Announce Type: replace 
Abstract: As Large Language Models (LLMs) can now process extremely long contexts, efficient inference over these extended inputs has become increasingly imp"
cs.CL,cs.CL_143,"Large Language Models for Outpatient Referral: Problem Definition, Benchmarking and Challenges",https://arxiv.org/abs/2503.08292,"arXiv:2503.08292v4 Announce Type: replace 
Abstract: Large language models (LLMs) are increasingly applied to outpatient referral tasks across healthcare systems. However, there is a lack of standardi"
cs.CL,cs.CL_144,LongWriter-Zero: Mastering Ultra-Long Text Generation via Reinforcement Learning,https://arxiv.org/abs/2506.18841,"arXiv:2506.18841v3 Announce Type: replace 
Abstract: Ultra-long generation by large language models (LLMs) is a widely demanded scenario, yet it remains a significant challenge due to their maximum ge"
cs.CL,cs.CL_145,Reward Models Can Improve Themselves: Reward-Guided Adversarial Failure Mode Discovery for Robust Reward Modeling,https://arxiv.org/abs/2507.06419,"arXiv:2507.06419v2 Announce Type: replace 
Abstract: Reward modeling (RM), which captures human preferences to align large language models (LLMs), is increasingly employed in tasks such as model finet"
cs.CL,cs.CL_146,Soft Head Selection for Injecting ICL-Derived Task Embeddings,https://arxiv.org/abs/2507.20906,"arXiv:2507.20906v3 Announce Type: replace 
Abstract: Large language models (LLMs) are commonly adapted to downstream tasks using parameter-efficient fine-tuning (PEFT) or in-context learning (ICL). Re"
cs.CL,cs.CL_147,SEA-BED: How Do Embedding Models Represent Southeast Asian Languages?,https://arxiv.org/abs/2508.12243,"arXiv:2508.12243v3 Announce Type: replace 
Abstract: Multilingual text embeddings are often assumed to encode meaning in a perspective-independent semantic space, yielding stable similarity judgments "
cs.CL,cs.CL_148,LifeAlign: Lifelong Alignment for Large Language Models with Memory-Augmented Focalized Preference Optimization,https://arxiv.org/abs/2509.17183,"arXiv:2509.17183v3 Announce Type: replace 
Abstract: Alignment plays a crucial role in Large Language Models (LLMs) in aligning with human preferences on a specific task/domain. Traditional alignment "
cs.CL,cs.CL_149,Between Help and Harm: An Evaluation of Mental Health Crisis Handling by LLMs,https://arxiv.org/abs/2509.24857,"arXiv:2509.24857v3 Announce Type: replace 
Abstract: Large language model-powered chatbots have transformed how people seek information, especially in high-stakes contexts like mental health. Despite "
cs.CL,cs.CL_150,"The Rise of AfricaNLP: A Survey of Contributions, Contributors, Community Impact, and Bibliometric Analysis",https://arxiv.org/abs/2509.25477,"arXiv:2509.25477v5 Announce Type: replace 
Abstract: Natural Language Processing (NLP) is undergoing constant transformation, as Large Language Models (LLMs) are driving daily breakthroughs in researc"
cs.CL,cs.CL_151,Mismatch Aware Guidance for Robust Emotion Control in Auto-Regressive TTS Models,https://arxiv.org/abs/2510.13293,"arXiv:2510.13293v2 Announce Type: replace 
Abstract: While Text-to-Speech (TTS) systems can achieve fine-grained control over emotional expression via natural language prompts, a significant challenge"
