category,paper_id,title,link,summary
cs.LG,cs.LG_231,Algebraic Diversity: Group-Theoretic Spectral Estimation from Single Observations,https://arxiv.org/abs/2604.03634,"arXiv:2604.03634v2 Announce Type: replace 
Abstract: We establish that temporal averaging over multiple observations is the degenerate case of algebraic group action with the trivial group $G=\{e\}$. "
cs.LG,cs.LG_232,k-Maximum Inner Product Attention for Graph Transformers and the Expressive Power of GraphGPS,https://arxiv.org/abs/2604.03815,"arXiv:2604.03815v2 Announce Type: replace 
Abstract: Graph transformers have shown promise in overcoming limitations of traditional graph neural networks, such as oversquashing and difficulties in mod"
cs.LG,cs.LG_233,A Clinical Point Cloud Paradigm for In-Hospital Mortality Prediction from Multi-Level Incomplete Multimodal EHRs,https://arxiv.org/abs/2604.04614,"arXiv:2604.04614v2 Announce Type: replace 
Abstract: Deep learning-based modeling of multimodal Electronic Health Records (EHRs) has become an important approach for clinical diagnosis and risk predic"
cs.LG,cs.LG_234,Noise Immunity in In-Context Tabular Learning: An Empirical Robustness Analysis of TabPFN's Attention Mechanisms,https://arxiv.org/abs/2604.04868,"arXiv:2604.04868v2 Announce Type: replace 
Abstract: Tabular foundation models (TFMs) such as TabPFN (Tabular Prior-Data Fitted Network) are designed to generalize across heterogeneous tabular dataset"
cs.LG,cs.LG_235,Active Statistical Inference,https://arxiv.org/abs/2403.03208,"arXiv:2403.03208v3 Announce Type: replace-cross 
Abstract: Inspired by the concept of active learning, we propose active inference$\unicode{x2013}$a methodology for statistical inference with machine-"
cs.LG,cs.LG_236,Resistance Distance and Linearized Optimal Transport on Graphs,https://arxiv.org/abs/2404.15261,"arXiv:2404.15261v4 Announce Type: replace-cross 
Abstract: We study the linearization of a discrete transportation distance between probability distributions on finite weighted graphs originally due t"
cs.LG,cs.LG_237,Thompson Sampling for Infinite-Horizon Discounted Decision Processes,https://arxiv.org/abs/2405.08253,"arXiv:2405.08253v3 Announce Type: replace-cross 
Abstract: This paper develops a viable notion of learning for sampling-based algorithms that applies in broader settings than previously considered. Mo"
cs.LG,cs.LG_238,Differentially Private Best-Arm Identification,https://arxiv.org/abs/2406.06408,"arXiv:2406.06408v2 Announce Type: replace-cross 
Abstract: Best Arm Identification (BAI) problems are progressively used for data-sensitive applications, such as designing adaptive clinical trials, tu"
cs.LG,cs.LG_239,Exploring Natural Language-Based Strategies for Efficient Number Learning in Children through Reinforcement Learning,https://arxiv.org/abs/2410.08334,"arXiv:2410.08334v2 Announce Type: replace-cross 
Abstract: In this paper, we build a reinforcement learning framework to study how children compose numbers using base-ten blocks. Studying numerical co"
cs.LG,cs.LG_240,Nonparametric Instrumental Regression via Kernel Methods is Minimax Optimal,https://arxiv.org/abs/2411.19653,"arXiv:2411.19653v2 Announce Type: replace-cross 
Abstract: We study the kernel instrumental variable (KIV) algorithm, a kernel-based two-stage least-squares method for nonparametric instrumental varia"
cs.LG,cs.LG_241,Non-Expansive Mappings in Two-Time-Scale Stochastic Approximation: Finite-Time Analysis,https://arxiv.org/abs/2501.10806,"arXiv:2501.10806v4 Announce Type: replace-cross 
Abstract: Two-time-scale stochastic approximation algorithms are iterative methods used in applications such as optimization, reinforcement learning, a"
cs.LG,cs.LG_242,LongSpec: Long-Context Lossless Speculative Decoding with Efficient Drafting and Verification,https://arxiv.org/abs/2502.17421,"arXiv:2502.17421v4 Announce Type: replace-cross 
Abstract: As Large Language Models (LLMs) can now process extremely long contexts, efficient inference over these extended inputs has become increasing"
cs.LG,cs.LG_243,Spike-based alignment learning solves the weight transport problem,https://arxiv.org/abs/2503.02642,"arXiv:2503.02642v3 Announce Type: replace-cross 
Abstract: In both machine learning and in computational neuroscience, plasticity in functional neural networks is frequently expressed as gradient desc"
cs.LG,cs.LG_244,AHCQ-SAM: Toward Accurate and Hardware-Compatible Post-Training Segment Anything Model Quantization,https://arxiv.org/abs/2503.03088,"arXiv:2503.03088v4 Announce Type: replace-cross 
Abstract: The Segment Anything Model (SAM) has revolutionized image and video segmentation with its powerful zero-shot capabilities. However, its massi"
cs.LG,cs.LG_245,Computational bottlenecks for denoising diffusions,https://arxiv.org/abs/2503.08028,"arXiv:2503.08028v3 Announce Type: replace-cross 
Abstract: Denoising diffusions sample from a probability distribution $\mu$ in $\mathbb{R}^d$ by constructing a stochastic process $({\hat{\boldsymbol "
cs.LG,cs.LG_246,Lost in Cultural Translation: Do LLMs Struggle with Math Across Cultural Contexts?,https://arxiv.org/abs/2503.18018,"arXiv:2503.18018v2 Announce Type: replace-cross 
Abstract: We demonstrate that large language models' (LLMs) mathematical reasoning is culturally sensitive: testing 14 models from Anthropic, OpenAI, G"
cs.LG,cs.LG_247,A Giant-Step Baby-Step Classifier For Scalable and Real-Time Anomaly Detection In Industrial Control Systems and Water Treatment Systems,https://arxiv.org/abs/2504.20906,"arXiv:2504.20906v4 Announce Type: replace-cross 
Abstract: The continuous monitoring of the interactions between cyber-physical components of any industrial control system (ICS) is required to secure "
cs.LG,cs.LG_248,Apple: Toward General Active Perception via Reinforcement Learning,https://arxiv.org/abs/2505.06182,"arXiv:2505.06182v5 Announce Type: replace-cross 
Abstract: Active perception is a fundamental skill that enables us humans to deal with uncertainty in our inherently partially observable environment. "
cs.LG,cs.LG_249,LongWriter-Zero: Mastering Ultra-Long Text Generation via Reinforcement Learning,https://arxiv.org/abs/2506.18841,"arXiv:2506.18841v3 Announce Type: replace-cross 
Abstract: Ultra-long generation by large language models (LLMs) is a widely demanded scenario, yet it remains a significant challenge due to their maxi"
cs.LG,cs.LG_250,Neural Two-Stage Stochastic Optimization for Solving Unit Commitment Problem,https://arxiv.org/abs/2507.09503,"arXiv:2507.09503v2 Announce Type: replace-cross 
Abstract: This paper proposes a neural stochastic optimization method for efficiently solving the two-stage stochastic unit commitment (2S-SUC) problem"
cs.LG,cs.LG_251,MF-GLaM: A multifidelity stochastic emulator using generalized lambda models,https://arxiv.org/abs/2507.10303,"arXiv:2507.10303v2 Announce Type: replace-cross 
Abstract: Stochastic simulators exhibit intrinsic stochasticity due to unobservable, uncontrollable, or unmodeled input variables, resulting in random "
cs.LG,cs.LG_252,CNN-based Surface Temperature Forecasts with Ensemble Numerical Weather Prediction,https://arxiv.org/abs/2507.18937,"arXiv:2507.18937v3 Announce Type: replace-cross 
Abstract: Due to limited computational resources, medium-range temperature forecasts typically rely on low-resolution numerical weather prediction (NWP"
cs.LG,cs.LG_253,AugLift: Depth-Aware Input Reparameterization Improves Domain Generalization in 2D-to-3D Pose Lifting,https://arxiv.org/abs/2508.07112,"arXiv:2508.07112v4 Announce Type: replace-cross 
Abstract: Lifting-based 3D human pose estimation infers 3D joints from 2D keypoints but generalizes poorly because $(x,y)$ coordinates alone are an ill"
cs.LG,cs.LG_254,ShadowNPU: System and Algorithm Co-design for NPU-Centric On-Device LLM Inference,https://arxiv.org/abs/2508.16703,"arXiv:2508.16703v4 Announce Type: replace-cross 
Abstract: On-device running Large Language Models (LLMs) is nowadays a critical enabler towards preserving user privacy. We observe that the attention "
cs.LG,cs.LG_255,Synthetic Homes: A Multimodal Generative AI Pipeline for Residential Building Data Generation under Data Scarcity,https://arxiv.org/abs/2509.09794,"arXiv:2509.09794v4 Announce Type: replace-cross 
Abstract: Computational models have emerged as powerful tools for multi-scale energy modeling research at the building and urban scale, supporting data"
cs.LG,cs.LG_256,LifeAlign: Lifelong Alignment for Large Language Models with Memory-Augmented Focalized Preference Optimization,https://arxiv.org/abs/2509.17183,"arXiv:2509.17183v3 Announce Type: replace-cross 
Abstract: Alignment plays a crucial role in Large Language Models (LLMs) in aligning with human preferences on a specific task/domain. Traditional alig"
cs.LG,cs.LG_257,PAC-Bayesian Bounds on Constrained f-Entropic Risk Measures,https://arxiv.org/abs/2510.11169,"arXiv:2510.11169v2 Announce Type: replace-cross 
Abstract: PAC generalization bounds on the risk, when expressed in terms of the expected loss, are often insufficient to capture imbalances between sub"
cs.LG,cs.LG_258,One Life to Learn: Inferring Symbolic World Models for Stochastic Environments from Unguided Exploration,https://arxiv.org/abs/2510.12088,"arXiv:2510.12088v2 Announce Type: replace-cross 
Abstract: Symbolic world modeling requires inferring and representing an environment's transitional dynamics as an executable program. Prior work has f"
cs.LG,cs.LG_259,RLBoost: Harvesting Preemptible Resources for Cost-Efficient Reinforcement Learning on LLMs,https://arxiv.org/abs/2510.19225,"arXiv:2510.19225v3 Announce Type: replace-cross 
Abstract: Reinforcement learning (RL) has become essential for unlocking advanced reasoning capabilities in large language models (LLMs). RL workflows "
cs.LG,cs.LG_260,PULSE: Privileged Knowledge Transfer from Rich to Deployable Sensors for Embodied Multi-Sensory Learning,https://arxiv.org/abs/2510.24058,"arXiv:2510.24058v2 Announce Type: replace-cross 
Abstract: Multi-sensory systems for embodied intelligence, from wearable body-sensor networks to instrumented robotic platforms, routinely face a senso"
cs.LG,cs.LG_261,DisCEdge: Distributed Context Management for Large Language Models at the Edge,https://arxiv.org/abs/2511.22599,"arXiv:2511.22599v2 Announce Type: replace-cross 
Abstract: Deploying Large Language Model (LLM) services at the edge benefits latency-sensitive and privacy-aware applications. However, the stateless n"
cs.LG,cs.LG_262,Physics-Informed Neural Networks for Source Inversion and Parameters Estimation in Atmospheric Dispersion,https://arxiv.org/abs/2512.07755,"arXiv:2512.07755v2 Announce Type: replace-cross 
Abstract: Recent studies have shown the success of deep learning in solving forward and inverse problems in engineering and scientific computing domain"
cs.LG,cs.LG_263,Probabilistic Predictions of Process-Induced Deformation in Carbon/Epoxy Composites Using a Deep Operator Network,https://arxiv.org/abs/2512.13746,"arXiv:2512.13746v4 Announce Type: replace-cross 
Abstract: Fiber reinforcement and polymer matrix respond differently to manufacturing conditions due to mismatch in coefficient of thermal expansion an"
cs.LG,cs.LG_264,LeLaR: The First In-Orbit Demonstration of an AI-Based Satellite Attitude Controller,https://arxiv.org/abs/2512.19576,"arXiv:2512.19576v5 Announce Type: replace-cross 
Abstract: Attitude control is essential for many satellite missions. Classical controllers, however, are time-consuming to design and sensitive to mode"
cs.LG,cs.LG_265,Fast reconstruction-based ROI triggering via anomaly detection in the CYGNO optical TPC,https://arxiv.org/abs/2512.24290,"arXiv:2512.24290v2 Announce Type: replace-cross 
Abstract: Optical-readout Time Projection Chambers (TPCs) produce megapixel-scale images whose fine-grained topological information is essential for ra"
cs.LG,cs.LG_266,ADOPT: Adaptive Dependency-Guided Joint Prompt Optimization for Multi-Step LLM Pipelines,https://arxiv.org/abs/2512.24933,"arXiv:2512.24933v2 Announce Type: replace-cross 
Abstract: Multi-step LLM pipelines can solve complex tasks, but jointly optimizing prompts across steps remains challenging due to missing step-level s"
cs.LG,cs.LG_267,Concave Certificates: Geometric Framework for Distributionally Robust Risk and Complexity Analysis,https://arxiv.org/abs/2601.01311,"arXiv:2601.01311v2 Announce Type: replace-cross 
Abstract: Distributionally Robust (DR) optimization aims to certify worst-case risk within a Wasserstein uncertainty set. Current certifications typica"
cs.LG,cs.LG_268,ConvoLearn: A Dataset for Fine-Tuning Dialogic AI Tutors,https://arxiv.org/abs/2601.08950,"arXiv:2601.08950v3 Announce Type: replace-cross 
Abstract: Despite their growing adoption in education, LLMs remain misaligned with the core principle of effective tutoring: the dialogic construction "
cs.LG,cs.LG_269,Theory and interpretability of Quantum Extreme Learning Machines: a Pauli-transfer matrix approach,https://arxiv.org/abs/2602.18377,"arXiv:2602.18377v3 Announce Type: replace-cross 
Abstract: Quantum reservoir computers (QRCs) have emerged as a promising approach to quantum machine learning, since they utilize the natural dynamics "
cs.LG,cs.LG_270,Robust support vector model based on bounded asymmetric elastic net loss for binary classification,https://arxiv.org/abs/2603.06257,"arXiv:2603.06257v2 Announce Type: replace-cross 
Abstract: In this paper, we propose a novel bounded asymmetric elastic net ($L_{baen}$) loss function and combine it with the support vector machine (S"
cs.LG,cs.LG_271,Resource-constrained Amazons chess decision framework integrating large language models and graph attention,https://arxiv.org/abs/2603.10512,"arXiv:2603.10512v2 Announce Type: replace-cross 
Abstract: Artificial intelligence has advanced significantly through the development of intelligent game-playing systems, providing rigorous testbeds f"
cs.LG,cs.LG_272,AgriPath: A Systematic Exploration of Architectural Trade-offs for Crop Disease Classification,https://arxiv.org/abs/2603.13354,"arXiv:2603.13354v3 Announce Type: replace-cross 
Abstract: Reliable crop disease detection requires models that perform consistently across diverse acquisition conditions, yet existing evaluations oft"
cs.LG,cs.LG_273,Conditional flow matching for physics-constrained inverse problems with finite training data,https://arxiv.org/abs/2603.14135,"arXiv:2603.14135v3 Announce Type: replace-cross 
Abstract: This study presents a conditional flow matching framework for solving physics-constrained Bayesian inverse problems. In this setting, samples"
cs.LG,cs.LG_274,ChopGrad: Pixel-Wise Losses for Latent Video Diffusion via Truncated Backpropagation,https://arxiv.org/abs/2603.17812,"arXiv:2603.17812v2 Announce Type: replace-cross 
Abstract: Recent video diffusion models achieve high-quality generation through recurrent frame processing where each frame generation depends on previ"
cs.LG,cs.LG_275,From Synthetic Data to Real Restorations: Diffusion Model for Patient-specific Dental Crown Completion,https://arxiv.org/abs/2603.26588,"arXiv:2603.26588v2 Announce Type: replace-cross 
Abstract: We present ToothCraft, a diffusion-based model for the contextual generation of tooth crowns, trained on artificially created incomplete teet"
cs.LG,cs.LG_276,Neural Harmonic Textures for High-Quality Primitive Based Neural Reconstruction,https://arxiv.org/abs/2604.01204,"arXiv:2604.01204v2 Announce Type: replace-cross 
Abstract: Primitive-based methods such as 3D Gaussian Splatting have recently become the state-of-the-art for novel-view synthesis and related reconstr"
cs.LG,cs.LG_277,VisionClaw: Always-On AI Agents through Smart Glasses,https://arxiv.org/abs/2604.03486,"arXiv:2604.03486v2 Announce Type: replace-cross 
Abstract: We present VisionClaw, an always-on wearable AI agent that integrates live egocentric perception with agentic task execution. Running on Meta"
cs.LG,cs.LG_278,CodecFlow: Codec-Guided End-to-End Optimization for Streaming Video Analytics,https://arxiv.org/abs/2604.06036,"arXiv:2604.06036v2 Announce Type: replace-cross 
Abstract: Video streaming analytics is a crucial workload for vision-language model serving, but the high cost of multimodal inference limits scalabili"
