category,paper_id,title,link,summary
cs.LG,cs.LG_77,"SBBTS: A Unified Schr\""odinger-Bass Framework for Synthetic Financial Time Series",https://arxiv.org/abs/2604.07159,"arXiv:2604.07159v1 Announce Type: new 
Abstract: We study the problem of generating synthetic time series that reproduce both marginal distributions and temporal dynamics, a central challenge in finan"
cs.LG,cs.LG_78,Smart Commander: A Hierarchical Reinforcement Learning Framework for Fleet-Level PHM Decision Optimization,https://arxiv.org/abs/2604.07171,"arXiv:2604.07171v1 Announce Type: new 
Abstract: Decision-making in military aviation Prognostics and Health Management (PHM) faces significant challenges due to the ""curse of dimensionality"" in large"
cs.LG,cs.LG_79,Improving Semantic Uncertainty Quantification in Language Model Question-Answering via Token-Level Temperature Scaling,https://arxiv.org/abs/2604.07172,"arXiv:2604.07172v1 Announce Type: new 
Abstract: Calibration is central to reliable semantic uncertainty quantification, yet prior work has largely focused on discrimination, neglecting calibration. A"
cs.LG,cs.LG_80,Mixture Proportion Estimation and Weakly-supervised Kernel Test for Conditional Independence,https://arxiv.org/abs/2604.07191,"arXiv:2604.07191v1 Announce Type: new 
Abstract: Mixture proportion estimation (MPE) aims to estimate class priors from unlabeled data. This task is a critical component in weakly supervised learning,"
cs.LG,cs.LG_81,Beyond the Mean: Modelling Annotation Distributions in Continuous Affect Prediction,https://arxiv.org/abs/2604.07198,"arXiv:2604.07198v1 Announce Type: new 
Abstract: Emotion annotation is inherently subjective and cognitively demanding, producing signals that reflect diverse perceptions across annotators rather than"
cs.LG,cs.LG_82,Diffusion Processes on Implicit Manifolds,https://arxiv.org/abs/2604.07213,"arXiv:2604.07213v1 Announce Type: new 
Abstract: High-dimensional data are often modeled as lying near a low-dimensional manifold. We study how to construct diffusion processes on this data manifold i"
cs.LG,cs.LG_83,How Does Machine Learning Manage Complexity?,https://arxiv.org/abs/2604.07233,"arXiv:2604.07233v1 Announce Type: new 
Abstract: We provide a computational complexity lens to understand the power of machine learning models, particularly their ability to model complex systems.
  M"
cs.LG,cs.LG_84,On the Price of Privacy for Language Identification and Generation,https://arxiv.org/abs/2604.07238,"arXiv:2604.07238v1 Announce Type: new 
Abstract: As large language models (LLMs) are increasingly trained on sensitive user data, understanding the fundamental cost of privacy in language learning bec"
cs.LG,cs.LG_85,"Weaves, Wires, and Morphisms: Formalizing and Implementing the Algebra of Deep Learning",https://arxiv.org/abs/2604.07242,"arXiv:2604.07242v1 Announce Type: new 
Abstract: Despite deep learning models running well-defined mathematical functions, we lack a formal mathematical framework for describing model architectures. A"
cs.LG,cs.LG_86,A comparative analysis of machine learning models in SHAP analysis,https://arxiv.org/abs/2604.07258,"arXiv:2604.07258v1 Announce Type: new 
Abstract: In this growing age of data and technology, large black-box models are becoming the norm due to their ability to handle vast amounts of data and learn "
cs.LG,cs.LG_87,Tracking Adaptation Time: Metrics for Temporal Distribution Shift,https://arxiv.org/abs/2604.07266,"arXiv:2604.07266v1 Announce Type: new 
Abstract: Evaluating robustness under temporal distribution shift remains an open challenge. Existing metrics quantify the average decline in performance, but fa"
cs.LG,cs.LG_88,Android Coach: Improve Online Agentic Training Efficiency with Single State Multiple Actions,https://arxiv.org/abs/2604.07277,"arXiv:2604.07277v1 Announce Type: new 
Abstract: Online reinforcement learning (RL) serves as an effective method for enhancing the capabilities of Android agents. However, guiding agents to learn thr"
cs.LG,cs.LG_89,Graph Neural ODE Digital Twins for Control-Oriented Reactor Thermal-Hydraulic Forecasting Under Partial Observability,https://arxiv.org/abs/2604.07292,"arXiv:2604.07292v1 Announce Type: new 
Abstract: Real-time supervisory control of advanced reactors requires accurate forecasting of plant-wide thermal-hydraulic states, including locations where phys"
cs.LG,cs.LG_90,SL-FAC: A Communication-Efficient Split Learning Framework with Frequency-Aware Compression,https://arxiv.org/abs/2604.07316,"arXiv:2604.07316v1 Announce Type: new 
Abstract: The growing complexity of neural networks hinders the deployment of distributed machine learning on resource-constrained devices. Split learning (SL) o"
cs.LG,cs.LG_91,How to sketch a learning algorithm,https://arxiv.org/abs/2604.07328,"arXiv:2604.07328v1 Announce Type: new 
Abstract: How does the choice of training data influence an AI model? This question is of central importance to interpretability, privacy, and basic science. At "
cs.LG,cs.LG_92,MedRoute: RL-Based Dynamic Specialist Routing in Multi-Agent Medical Diagnosis,https://arxiv.org/abs/2604.06180,"arXiv:2604.06180v1 Announce Type: cross 
Abstract: Medical diagnosis using Large Multimodal Models (LMMs) has gained increasing attention due to capability of these models in providing precise diagnos"
cs.LG,cs.LG_93,The Stepwise Informativeness Assumption: Why are Entropy Dynamics and Reasoning Correlated in LLMs?,https://arxiv.org/abs/2604.06192,"arXiv:2604.06192v1 Announce Type: cross 
Abstract: Recent work uses entropy-based signals at multiple representation levels to study reasoning in large language models, but the field remains largely e"
cs.LG,cs.LG_94,Distributional Open-Ended Evaluation of LLM Cultural Value Alignment Based on Value Codebook,https://arxiv.org/abs/2604.06210,"arXiv:2604.06210v1 Announce Type: cross 
Abstract: As LLMs are globally deployed, aligning their cultural value orientations is critical for safety and user engagement. However, existing benchmarks fa"
cs.LG,cs.LG_95,Toward Reducing Unproductive Container Moves: Predicting Service Requirements and Dwell Times,https://arxiv.org/abs/2604.06251,"arXiv:2604.06251v1 Announce Type: cross 
Abstract: This article presents the results of a data science study conducted at a container terminal, aimed at reducing unproductive container moves through t"
cs.LG,cs.LG_96,Incentive-Aware Multi-Fidelity Optimization for Generative Advertising in Large Language Models,https://arxiv.org/abs/2604.06263,"arXiv:2604.06263v1 Announce Type: cross 
Abstract: Generative advertising in large language model (LLM) responses requires optimizing sponsorship configurations under two strict constraints: the strat"
cs.LG,cs.LG_97,Weakly Supervised Distillation of Hallucination Signals into Transformer Representations,https://arxiv.org/abs/2604.06277,"arXiv:2604.06277v1 Announce Type: cross 
Abstract: Existing hallucination detection methods for large language models (LLMs) rely on external verification at inference time, requiring gold answers, re"
cs.LG,cs.LG_98,Tight Convergence Rates for Online Distributed Linear Estimation with Adversarial Measurements,https://arxiv.org/abs/2604.06282,"arXiv:2604.06282v1 Announce Type: cross 
Abstract: We study mean estimation of a random vector $X$ in a distributed parameter-server-worker setup. Worker $i$ observes samples of $a_i^\top X$, where $a"
cs.LG,cs.LG_99,Adversarial Robustness of Time-Series Classification for Crystal Collimator Alignment,https://arxiv.org/abs/2604.06289,"arXiv:2604.06289v1 Announce Type: cross 
Abstract: In this paper, we analyze and improve the adversarial robustness of a convolutional neural network (CNN) that assists crystal-collimator alignment at"
cs.LG,cs.LG_100,FedSpy-LLM: Towards Scalable and Generalizable Data Reconstruction Attacks from Gradients on LLMs,https://arxiv.org/abs/2604.06297,"arXiv:2604.06297v1 Announce Type: cross 
Abstract: Given the growing reliance on private data in training Large Language Models (LLMs), Federated Learning (FL) combined with Parameter-Efficient Fine-T"
cs.LG,cs.LG_101,Telescope: Learnable Hyperbolic Foveation for Ultra-Long-Range Object Detection,https://arxiv.org/abs/2604.06332,"arXiv:2604.06332v1 Announce Type: cross 
Abstract: Autonomous highway driving, especially for long-haul heavy trucks, requires detecting objects at long ranges beyond 500 meters to satisfy braking dis"
cs.LG,cs.LG_102,WebSP-Eval: Evaluating Web Agents on Website Security and Privacy Tasks,https://arxiv.org/abs/2604.06367,"arXiv:2604.06367v1 Announce Type: cross 
Abstract: Web agents automate browser tasks, ranging from simple form completion to complex workflows like ordering groceries. While current benchmarks evaluat"
cs.LG,cs.LG_103,ForkKV: Scaling Multi-LoRA Agent Serving via Copy-on-Write Disaggregated KV Cache,https://arxiv.org/abs/2604.06370,"arXiv:2604.06370v1 Announce Type: cross 
Abstract: The serving paradigm of large language models (LLMs) is rapidly shifting towards complex multi-agent workflows where specialized agents collaborate o"
cs.LG,cs.LG_104,The Illusion of Superposition? A Principled Analysis of Latent Thinking in Language Models,https://arxiv.org/abs/2604.06374,"arXiv:2604.06374v1 Announce Type: cross 
Abstract: Latent reasoning via continuous chain-of-thoughts (Latent CoT) has emerged as a promising alternative to discrete CoT reasoning. Operating in continu"
cs.LG,cs.LG_105,Revisiting Fairness Impossibility with Endogenous Behavior,https://arxiv.org/abs/2604.06378,"arXiv:2604.06378v1 Announce Type: cross 
Abstract: In many real-world settings, institutions can and do adjust the consequences attached to algorithmic classification decisions, such as the size of fi"
cs.LG,cs.LG_106,Calibration of a neural network ocean closure for improved mean state and variability,https://arxiv.org/abs/2604.06398,"arXiv:2604.06398v1 Announce Type: cross 
Abstract: Global ocean models exhibit biases in the mean state and variability, particularly at coarse resolution, where mesoscale eddies are unresolved. To ad"
cs.LG,cs.LG_107,ProofSketcher: Hybrid LLM + Lightweight Proof Checker for Reliable Math/Logic Reasoning,https://arxiv.org/abs/2604.06401,"arXiv:2604.06401v1 Announce Type: cross 
Abstract: The large language models (LLMs) might produce a persuasive argument within mathematical and logical fields, although such argument often includes so"
cs.LG,cs.LG_108,"Towards Resilient Intrusion Detection in CubeSats: Challenges, TinyML Solutions, and Future Directions",https://arxiv.org/abs/2604.06411,"arXiv:2604.06411v1 Announce Type: cross 
Abstract: CubeSats have revolutionized access to space by providing affordable and accessible platforms for research and education. However, their reliance on "
cs.LG,cs.LG_109,Attention Flows: Tracing LLM Conceptual Engagement via Story Summaries,https://arxiv.org/abs/2604.06416,"arXiv:2604.06416v1 Announce Type: cross 
Abstract: Although LLM context lengths have grown, there is evidence that their ability to integrate information across long-form texts has not kept pace. We e"
cs.LG,cs.LG_110,The Unreasonable Effectiveness of Data for Recommender Systems,https://arxiv.org/abs/2604.06420,"arXiv:2604.06420v1 Announce Type: cross 
Abstract: In recommender systems, collecting, storing, and processing large-scale interaction data is increasingly costly in terms of time, energy, and computa"
cs.LG,cs.LG_111,Operator Learning for Surrogate Modeling of Wave-Induced Forces from Sea Surface Waves,https://arxiv.org/abs/2604.06433,"arXiv:2604.06433v1 Announce Type: cross 
Abstract: Wave setup plays a significant role in transferring wave-induced energy to currents and causing an increase in water elevation. This excess momentum "
cs.LG,cs.LG_112,Learning Debt and Cost-Sensitive Bayesian Retraining: A Forecasting Operations Framework,https://arxiv.org/abs/2604.06438,"arXiv:2604.06438v1 Announce Type: cross 
Abstract: Forecasters often choose retraining schedules by convention rather than by an explicit decision rule. This paper gives that decision a posterior-spac"
cs.LG,cs.LG_113,Visual prompting reimagined: The power of the Activation Prompts,https://arxiv.org/abs/2604.06440,"arXiv:2604.06440v1 Announce Type: cross 
Abstract: Visual prompting (VP) has emerged as a popular method to repurpose pretrained vision models for adaptation to downstream tasks. Unlike conventional m"
cs.LG,cs.LG_114,Anticipating tipping in spatiotemporal systems with machine learning,https://arxiv.org/abs/2604.06454,"arXiv:2604.06454v1 Announce Type: cross 
Abstract: In nonlinear dynamical systems, tipping refers to a critical transition from one steady state to another, typically catastrophic, steady state, often"
cs.LG,cs.LG_115,Spatiotemporal Gaussian representation-based dynamic reconstruction and motion estimation framework for time-resolved volumetric MR imaging (DREME-GSMR),https://arxiv.org/abs/2604.06482,"arXiv:2604.06482v1 Announce Type: cross 
Abstract: Time-resolved volumetric MR imaging that reconstructs a 3D MRI within sub-seconds to resolve deformable motion is essential for motion-adaptive radio"
cs.LG,cs.LG_116,Soft-Quantum Algorithms,https://arxiv.org/abs/2604.06523,"arXiv:2604.06523v1 Announce Type: cross 
Abstract: Quantum operations on pure states can be fully represented by unitary matrices. Variational quantum circuits, also known as quantum neural networks, "
cs.LG,cs.LG_117,Stochastic Auto-conditioned Fast Gradient Methods with Optimal Rates,https://arxiv.org/abs/2604.06525,"arXiv:2604.06525v1 Announce Type: cross 
Abstract: Achieving optimal rates for stochastic composite convex optimization without prior knowledge of problem parameters remains a central challenge. In th"
cs.LG,cs.LG_118,"A Generalized Sinkhorn Algorithm for Mean-Field Schr\""odinger Bridge",https://arxiv.org/abs/2604.06531,"arXiv:2604.06531v1 Announce Type: cross 
Abstract: The mean-field Schr\""odinger bridge (MFSB) problem concerns designing a minimum-effort controller that guides a diffusion process with nonlocal inter"
cs.LG,cs.LG_119,Quantum-Inspired Tensor Network Autoencoders for Anomaly Detection: A MERA-Based Approach,https://arxiv.org/abs/2604.06541,"arXiv:2604.06541v1 Announce Type: cross 
Abstract: We investigate whether a multiscale tensor-network architecture can provide a useful inductive bias for reconstruction-based anomaly detection in col"
cs.LG,cs.LG_120,The Illusion of Stochasticity in LLMs,https://arxiv.org/abs/2604.06543,"arXiv:2604.06543v1 Announce Type: cross 
Abstract: In this work, we demonstrate that reliable stochastic sampling is a fundamental yet unfulfilled requirement for Large Language Models (LLMs) operatin"
cs.LG,cs.LG_121,ExplainFuzz: Explainable and Constraint-Conditioned Test Generation with Probabilistic Circuits,https://arxiv.org/abs/2604.06559,"arXiv:2604.06559v1 Announce Type: cross 
Abstract: Understanding and explaining the structure of generated test inputs is essential for effective software testing and debugging. Existing approaches--i"
cs.LG,cs.LG_122,Accelerating 4D Hyperspectral Imaging through Physics-Informed Neural Representation and Adaptive Sampling,https://arxiv.org/abs/2604.06561,"arXiv:2604.06561v1 Announce Type: cross 
Abstract: High-dimensional hyperspectral imaging (HSI) enables the visualization of ultrafast molecular dynamics and complex, heterogeneous spectra. However, a"
cs.LG,cs.LG_123,LLM-based Schema-Guided Extraction and Validation of Missing-Person Intelligence from Heterogeneous Data Sources,https://arxiv.org/abs/2604.06571,"arXiv:2604.06571v1 Announce Type: cross 
Abstract: Missing-person and child-safety investigations rely on heterogeneous case documents, including structured forms, bulletin-style posters, and narrativ"
cs.LG,cs.LG_124,DynLP: Parallel Dynamic Batch Update for Label Propagation in Semi-Supervised Learning,https://arxiv.org/abs/2604.06596,"arXiv:2604.06596v1 Announce Type: cross 
Abstract: Semi-supervised learning aims to infer class labels using only a small fraction of labeled data. In graph-based semi-supervised learning, this is typ"
cs.LG,cs.LG_125,Neural parametric representations for thin-shell shape optimisation,https://arxiv.org/abs/2604.06612,"arXiv:2604.06612v1 Announce Type: cross 
Abstract: Shape optimisation of thin-shell structures requires a flexible, differentiable geometric representation suitable for gradient-based optimisation. We"
cs.LG,cs.LG_126,The Detection--Extraction Gap: Models Know the Answer Before They Can Say It,https://arxiv.org/abs/2604.06613,"arXiv:2604.06613v1 Announce Type: cross 
Abstract: Modern reasoning models continue generating long after the answer is already determined. Across five model configurations, two families, and three be"
cs.LG,cs.LG_127,Holistic Optimal Label Selection for Robust Prompt Learning under Partial Labels,https://arxiv.org/abs/2604.06614,"arXiv:2604.06614v1 Announce Type: cross 
Abstract: Prompt learning has gained significant attention as a parameter-efficient approach for adapting large pre-trained vision-language models to downstrea"
cs.LG,cs.LG_128,The Theorems of Dr. David Blackwell and Their Contributions to Artificial Intelligence,https://arxiv.org/abs/2604.06621,"arXiv:2604.06621v1 Announce Type: cross 
Abstract: Dr. David Blackwell was a mathematician and statistician of the first rank, whose contributions to statistical theory, game theory, and decision theo"
cs.LG,cs.LG_129,Variational Feature Compression for Model-Specific Representations,https://arxiv.org/abs/2604.06644,"arXiv:2604.06644v1 Announce Type: cross 
Abstract: As deep learning inference is increasingly deployed in shared and cloud-based settings, a growing concern is input repurposing, in which data submitt"
cs.LG,cs.LG_130,Towards Robust Content Watermarking Against Removal and Forgery Attacks,https://arxiv.org/abs/2604.06662,"arXiv:2604.06662v1 Announce Type: cross 
Abstract: Generated contents have raised serious concerns about copyright protection, image provenance, and credit attribution. A potential solution for these "
cs.LG,cs.LG_131,Foundry: Template-Based CUDA Graph Context Materialization for Fast LLM Serving Cold Start,https://arxiv.org/abs/2604.06664,"arXiv:2604.06664v1 Announce Type: cross 
Abstract: Modern LLM service providers increasingly rely on autoscaling and parallelism reconfiguration to respond to rapidly changing workloads, but cold-star"
cs.LG,cs.LG_132,Adaptive Prompt Structure Factorization: A Framework for Self-Discovering and Optimizing Compositional Prompt Programs,https://arxiv.org/abs/2604.06699,"arXiv:2604.06699v1 Announce Type: cross 
Abstract: Automated prompt optimization is crucial for eliciting reliable reasoning from large language models (LLMs), yet most API-only prompt optimizers iter"
cs.LG,cs.LG_133,Steering the Verifiability of Multimodal AI Hallucinations,https://arxiv.org/abs/2604.06714,"arXiv:2604.06714v1 Announce Type: cross 
Abstract: AI applications driven by multimodal large language models (MLLMs) are prone to hallucinations and pose considerable risks to human users. Crucially,"
cs.LG,cs.LG_134,CASE: Cadence-Aware Set Encoding for Large-Scale Next Basket Repurchase Recommendation,https://arxiv.org/abs/2604.06718,"arXiv:2604.06718v1 Announce Type: cross 
Abstract: Repurchase behavior is a primary signal in large-scale retail recommendation, particularly in categories with frequent replenishment: many items in a"
cs.LG,cs.LG_135,Beyond Pessimism: Offline Learning in KL-regularized Games,https://arxiv.org/abs/2604.06738,"arXiv:2604.06738v1 Announce Type: cross 
Abstract: We study offline learning in KL-regularized two-player zero-sum games, where policies are optimized under a KL constraint to a fixed reference policy"
cs.LG,cs.LG_136,CBM-Dual: A 65-nm Fully Connected Chaotic Boltzmann Machine Processor for Dual Function Simulated Annealing and Reservoir Computing,https://arxiv.org/abs/2604.06808,"arXiv:2604.06808v1 Announce Type: cross 
Abstract: This paper presents CBM-Dual, the first silicon-proven digital chaotic dynamics processor (CDP) supporting both simulated annealing (SA) and reservoi"
cs.LG,cs.LG_137,FedDetox: Robust Federated SLM Alignment via On-Device Data Sanitization,https://arxiv.org/abs/2604.06833,"arXiv:2604.06833v1 Announce Type: cross 
Abstract: As high quality public data becomes scarce, Federated Learning (FL) provides a vital pathway to leverage valuable private user data while preserving "
cs.LG,cs.LG_138,Explaining Neural Networks in Preference Learning: a Post-hoc Inductive Logic Programming Approach,https://arxiv.org/abs/2604.06838,"arXiv:2604.06838v1 Announce Type: cross 
Abstract: In this paper, we propose using Learning from Answer Sets to approximate black-box models, such as Neural Networks (NN), in the specific case of lear"
cs.LG,cs.LG_139,A Data-Informed Variational Clustering Framework for Noisy High-Dimensional Data,https://arxiv.org/abs/2604.06864,"arXiv:2604.06864v1 Announce Type: cross 
Abstract: Clustering in high-dimensional settings with severe feature noise remains challenging, especially when only a small subset of dimensions is informati"
cs.LG,cs.LG_140,Energy-Regularized Spatial Masking: A Novel Approach to Enhancing Robustness and Interpretability in Vision Models,https://arxiv.org/abs/2604.06893,"arXiv:2604.06893v1 Announce Type: cross 
Abstract: Deep convolutional neural networks achieve remarkable performance by exhaustively processing dense spatial feature maps, yet this brute-force strateg"
cs.LG,cs.LG_141,Data Leakage in Automotive Perception: Practitioners' Insights,https://arxiv.org/abs/2604.06899,"arXiv:2604.06899v1 Announce Type: cross 
Abstract: Data leakage is the inadvertent transfer of information between training and evaluation datasets that poses a subtle, yet critical, risk to the relia"
cs.LG,cs.LG_142,Continuous-Time Dynamics of the Difference-of-Convex Algorithm,https://arxiv.org/abs/2604.06926,"arXiv:2604.06926v1 Announce Type: cross 
Abstract: We study the continuous-time structure of the difference-of-convex algorithm (DCA) for smooth DC decompositions with a strongly convex component. In "
cs.LG,cs.LG_143,"Evaluating PQC KEMs, Combiners, and Cascade Encryption via Adaptive IND-CPA Testing Using Deep Learning",https://arxiv.org/abs/2604.06942,"arXiv:2604.06942v1 Announce Type: cross 
Abstract: Ensuring ciphertext indistinguishability is fundamental to cryptographic security, but empirically validating this property in real implementations a"
cs.LG,cs.LG_144,"NestPipe: Large-Scale Recommendation Training on 1,500+ Accelerators via Nested Pipelining",https://arxiv.org/abs/2604.06956,"arXiv:2604.06956v1 Announce Type: cross 
Abstract: Modern recommendation models have increased to trillions of parameters. As cluster scales expand to O(1k), distributed training bottlenecks shift fro"
cs.LG,cs.LG_145,ELC: Evidential Lifelong Classifier for Uncertainty Aware Radar Pulse Classification,https://arxiv.org/abs/2604.06958,"arXiv:2604.06958v1 Announce Type: cross 
Abstract: Reliable radar pulse classification is essential in Electromagnetic Warfare for situational awareness and decision support. Deep Neural Networks have"
cs.LG,cs.LG_146,CAFP: A Post-Processing Framework for Group Fairness via Counterfactual Model Averaging,https://arxiv.org/abs/2604.07009,"arXiv:2604.07009v1 Announce Type: cross 
Abstract: Ensuring fairness in machine learning predictions is a critical challenge, especially when models are deployed in sensitive domains such as credit sc"
cs.LG,cs.LG_147,QNAS: A Neural Architecture Search Framework for Accurate and Efficient Quantum Neural Networks,https://arxiv.org/abs/2604.07013,"arXiv:2604.07013v1 Announce Type: cross 
Abstract: Designing quantum neural networks (QNNs) that are both accurate and deployable on NISQ hardware is challenging. Handcrafted ansatze must balance expr"
cs.LG,cs.LG_148,Physics-Informed Functional Link Constrained Framework with Domain Mapping for Solving Bending Analysis of an Exponentially Loaded Perforated Beam,https://arxiv.org/abs/2604.07025,"arXiv:2604.07025v1 Announce Type: cross 
Abstract: This article presents a novel and comprehensive approach for analyzing bending behavior of the tapered perforated beam under an exponential load. The"
cs.LG,cs.LG_149,ReDAct: Uncertainty-Aware Deferral for LLM Agents,https://arxiv.org/abs/2604.07036,"arXiv:2604.07036v1 Announce Type: cross 
Abstract: Recently, LLM-based agents have become increasingly popular across many applications, including complex sequential decision-making problems. However,"
cs.LG,cs.LG_150,Controller Design for Structured State-space Models via Contraction Theory,https://arxiv.org/abs/2604.07069,"arXiv:2604.07069v1 Announce Type: cross 
Abstract: This paper presents an indirect data-driven output feedback controller synthesis for nonlinear systems, leveraging Structured State-space Models (SSM"
cs.LG,cs.LG_151,"EVGeoQA: Benchmarking LLMs on Dynamic, Multi-Objective Geo-Spatial Exploration",https://arxiv.org/abs/2604.07070,"arXiv:2604.07070v1 Announce Type: cross 
Abstract: While Large Language Models (LLMs) demonstrate remarkable reasoning capabilities, their potential for purpose-driven exploration in dynamic geo-spati"
cs.LG,cs.LG_152,Accuracy Improvement of Semi-Supervised Segmentation Using Supervised ClassMix and Sup-Unsup Feature Discriminator,https://arxiv.org/abs/2604.07122,"arXiv:2604.07122v1 Announce Type: cross 
Abstract: In semantic segmentation, the creation of pixel-level labels for training data incurs significant costs. To address this problem, semi-supervised lea"
cs.LG,cs.LG_153,DDP-SA: Scalable Privacy-Preserving Federated Learning via Distributed Differential Privacy and Secure Aggregation,https://arxiv.org/abs/2604.07125,"arXiv:2604.07125v1 Announce Type: cross 
Abstract: This article presents DDP-SA, a scalable privacy-preserving federated learning framework that jointly leverages client-side local differential privac"
