category,paper_id,title,link,summary
cs.LG,cs.LG_154,Self-Discovered Intention-aware Transformer for Multi-modal Vehicle Trajectory Prediction,https://arxiv.org/abs/2604.07126,"arXiv:2604.07126v1 Announce Type: cross 
Abstract: Predicting vehicle trajectories plays an important role in autonomous driving and ITS applications. Although multiple deep learning algorithms are de"
cs.LG,cs.LG_155,A solver-in-the-loop framework for end-to-end differentiable coastal hydrodynamics,https://arxiv.org/abs/2604.07129,"arXiv:2604.07129v1 Announce Type: cross 
Abstract: Numerical simulation of wave propagation and run-up is a cornerstone of coastal engineering and tsunami hazard assessment. However, applying these fo"
cs.LG,cs.LG_156,CSA-Graphs: A Privacy-Preserving Structural Dataset for Child Sexual Abuse Research,https://arxiv.org/abs/2604.07132,"arXiv:2604.07132v1 Announce Type: cross 
Abstract: Child Sexual Abuse Imagery (CSAI) classification is an important yet challenging problem for computer vision research due to the strict legal and eth"
cs.LG,cs.LG_157,Energy Saving for Cell-Free Massive MIMO Networks: A Multi-Agent Deep Reinforcement Learning Approach,https://arxiv.org/abs/2604.07133,"arXiv:2604.07133v1 Announce Type: cross 
Abstract: This paper focuses on energy savings in downlink operation of cell-free massive MIMO (CF mMIMO) networks under dynamic traffic conditions. We propose"
cs.LG,cs.LG_158,Dynamic Context Evolution for Scalable Synthetic Data Generation,https://arxiv.org/abs/2604.07147,"arXiv:2604.07147v1 Announce Type: cross 
Abstract: Large language models produce repetitive output when prompted independently across many batches, a phenomenon we term cross-batch mode collapse: the "
cs.LG,cs.LG_159,"Reason in Chains, Learn in Trees: Self-Rectification and Grafting for Multi-turn Agent Policy Optimization",https://arxiv.org/abs/2604.07165,"arXiv:2604.07165v1 Announce Type: cross 
Abstract: Reinforcement learning for Large Language Model agents is often hindered by sparse rewards in multi-step reasoning tasks. Existing approaches like Gr"
cs.LG,cs.LG_160,DINO-QPM: Adapting Visual Foundation Models for Globally Interpretable Image Classification,https://arxiv.org/abs/2604.07166,"arXiv:2604.07166v1 Announce Type: cross 
Abstract: Although visual foundation models like DINOv2 provide state-of-the-art performance as feature extractors, their complex, high-dimensional representat"
cs.LG,cs.LG_161,Amortized Filtering and Smoothing with Conditional Normalizing Flows,https://arxiv.org/abs/2604.07169,"arXiv:2604.07169v1 Announce Type: cross 
Abstract: Bayesian filtering and smoothing for high-dimensional nonlinear dynamical systems are fundamental yet challenging problems in many areas of science a"
cs.LG,cs.LG_162,Splats under Pressure: Exploring Performance-Energy Trade-offs in Real-Time 3D Gaussian Splatting under Constrained GPU Budgets,https://arxiv.org/abs/2604.07177,"arXiv:2604.07177v1 Announce Type: cross 
Abstract: We investigate the feasibility of real-time 3D Gaussian Splatting (3DGS) rasterisation on edge clients with varying Gaussian splat counts and GPU com"
cs.LG,cs.LG_163,TeaLeafVision: An Explainable and Robust Deep Learning Framework for Tea Leaf Disease Classification,https://arxiv.org/abs/2604.07182,"arXiv:2604.07182v1 Announce Type: cross 
Abstract: As the worlds second most consumed beverage after water, tea is not just a cultural staple but a global economic force of profound scale and influenc"
cs.LG,cs.LG_164,The ATOM Report: Measuring the Open Language Model Ecosystem,https://arxiv.org/abs/2604.07190,"arXiv:2604.07190v1 Announce Type: cross 
Abstract: We present a comprehensive adoption snapshot of the leading open language models and who is building them, focusing on the ~1.5K mainline open models"
cs.LG,cs.LG_165,TraceSafe: A Systematic Assessment of LLM Guardrails on Multi-Step Tool-Calling Trajectories,https://arxiv.org/abs/2604.07223,"arXiv:2604.07223v1 Announce Type: cross 
Abstract: As large language models (LLMs) evolve from static chatbots into autonomous agents, the primary vulnerability surface shifts from final outputs to in"
cs.LG,cs.LG_166,Efficient Learned Data Compression via Dual-Stream Feature Decoupling,https://arxiv.org/abs/2604.07239,"arXiv:2604.07239v1 Announce Type: cross 
Abstract: While Learned Data Compression (LDC) has achieved superior compression ratios, balancing precise probability modeling with system efficiency remains "
cs.LG,cs.LG_167,$k$-server-bench: Automating Potential Discovery for the $k$-Server Conjecture,https://arxiv.org/abs/2604.07240,"arXiv:2604.07240v1 Announce Type: cross 
Abstract: We introduce a code-based challenge for automated, open-ended mathematical discovery based on the $k$-server conjecture, a central open problem in co"
cs.LG,cs.LG_168,Non-identifiability of Explanations from Model Behavior in Deep Networks of Image Authenticity Judgments,https://arxiv.org/abs/2604.07254,"arXiv:2604.07254v1 Announce Type: cross 
Abstract: Deep neural networks can predict human judgments, but this does not imply that they rely on human-like information or reveal the cues underlying thos"
cs.LG,cs.LG_169,The Theory and Practice of Highly Scalable Gaussian Process Regression with Nearest Neighbours,https://arxiv.org/abs/2604.07267,"arXiv:2604.07267v1 Announce Type: cross 
Abstract: Gaussian process ($GP$) regression is a widely used non-parametric modeling tool, but its cubic complexity in the training size limits its use on mas"
cs.LG,cs.LG_170,A Systematic Study of Retrieval Pipeline Design for Retrieval-Augmented Medical Question Answering,https://arxiv.org/abs/2604.07274,"arXiv:2604.07274v1 Announce Type: cross 
Abstract: Large language models (LLMs) have demonstrated strong capabilities in medical question answering; however, purely parametric models often suffer from"
cs.LG,cs.LG_171,Making Room for AI: Multi-GPU Molecular Dynamics with Deep Potentials in GROMACS,https://arxiv.org/abs/2604.07276,"arXiv:2604.07276v1 Announce Type: cross 
Abstract: GROMACS is a de-facto standard for classical Molecular Dynamics (MD). The rise of AI-driven interatomic potentials that pursue near-quantum accuracy "
cs.LG,cs.LG_172,Are Face Embeddings Compatible Across Deep Neural Network Models?,https://arxiv.org/abs/2604.07282,"arXiv:2604.07282v1 Announce Type: cross 
Abstract: Automated face recognition has made rapid strides over the past decade due to the unprecedented rise of deep neural network (DNN) models that can be "
cs.LG,cs.LG_173,CADENCE: Context-Adaptive Depth Estimation for Navigation and Computational Efficiency,https://arxiv.org/abs/2604.07286,"arXiv:2604.07286v1 Announce Type: cross 
Abstract: Autonomous vehicles deployed in remote environments typically rely on embedded processors, compact batteries, and lightweight sensors. These hardware"
cs.LG,cs.LG_174,Beyond Loss Values: Robust Dynamic Pruning via Loss Trajectory Alignment,https://arxiv.org/abs/2604.07306,"arXiv:2604.07306v1 Announce Type: cross 
Abstract: Existing dynamic data pruning methods often fail under noisy-label settings, as they typically rely on per-sample loss as the ranking criterion. This"
cs.LG,cs.LG_175,Gaussian Approximation for Asynchronous Q-learning,https://arxiv.org/abs/2604.07323,"arXiv:2604.07323v1 Announce Type: cross 
Abstract: In this paper, we derive rates of convergence in the high-dimensional central limit theorem for Polyak-Ruppert averaged iterates generated by the asy"
cs.LG,cs.LG_176,Personalized RewardBench: Evaluating Reward Models with Human Aligned Personalization,https://arxiv.org/abs/2604.07343,"arXiv:2604.07343v1 Announce Type: cross 
Abstract: Pluralistic alignment has emerged as a critical frontier in the development of Large Language Models (LLMs), with reward models (RMs) serving as a ce"
cs.LG,cs.LG_177,Measurement of Generative AI Workload Power Profiles for Whole-Facility Data Center Infrastructure Planning,https://arxiv.org/abs/2604.07345,"arXiv:2604.07345v1 Announce Type: cross 
Abstract: The rapid growth of generative artificial intelligence (AI) has introduced unprecedented computational demands, driving significant increases in the "
cs.LG,cs.LG_178,MoRight: Motion Control Done Right,https://arxiv.org/abs/2604.07348,"arXiv:2604.07348v1 Announce Type: cross 
Abstract: Generating motion-controlled videos--where user-specified actions drive physically plausible scene dynamics under freely chosen viewpoints--demands t"
cs.LG,cs.LG_179,Fast Spatial Memory with Elastic Test-Time Training,https://arxiv.org/abs/2604.07350,"arXiv:2604.07350v1 Announce Type: cross 
Abstract: Large Chunk Test-Time Training (LaCT) has shown strong performance on long-context 3D reconstruction, but its fully plastic inference-time updates re"
cs.LG,cs.LG_180,"An Automated Survey of Generative Artificial Intelligence: Large Language Models, Architectures, Protocols, and Applications",https://arxiv.org/abs/2306.02781,"arXiv:2306.02781v3 Announce Type: replace 
Abstract: Generative artificial intelligence, and large language models in particular, have emerged as one of the most transformative paradigms in modern com"
cs.LG,cs.LG_181,Smoothing the Edges: Smooth Optimization for Sparse Regularization using Hadamard Overparametrization,https://arxiv.org/abs/2307.03571,"arXiv:2307.03571v4 Announce Type: replace 
Abstract: We present a framework for smooth optimization of explicitly regularized objectives for (structured) sparsity. These non-smooth and possibly non-co"
cs.LG,cs.LG_182,Don't Label Twice: Quantity Beats Quality when Comparing Binary Classifiers on a Budget,https://arxiv.org/abs/2402.02249,"arXiv:2402.02249v3 Announce Type: replace 
Abstract: We study how to best spend a budget of noisy labels to compare the accuracy of two binary classifiers. It's common practice to collect and aggregat"
cs.LG,cs.LG_183,Novel Interpretable and Robust Web-based AI Platform for Phishing Email Detection,https://arxiv.org/abs/2405.11619,"arXiv:2405.11619v2 Announce Type: replace 
Abstract: Phishing emails continue to pose a significant threat, causing financial losses and security breaches. This study addresses limitations in existing"
cs.LG,cs.LG_184,AFL: A Single-Round Analytic Approach for Federated Learning with Pre-trained Models,https://arxiv.org/abs/2405.16240,"arXiv:2405.16240v3 Announce Type: replace 
Abstract: In this paper, we introduce analytic federated learning (AFL), a new training paradigm that brings analytical (i.e., closed-form) solutions to the "
cs.LG,cs.LG_185,SleepNet and DreamNet: Enriching and Reconstructing Representations for Consolidated Visual Classification,https://arxiv.org/abs/2409.01633,"arXiv:2409.01633v4 Announce Type: replace 
Abstract: An effective integration of rich feature representations with robust classification mechanisms remains a key challenge in visual understanding task"
cs.LG,cs.LG_186,Matrix Profile for Anomaly Detection on Multidimensional Time Series,https://arxiv.org/abs/2409.09298,"arXiv:2409.09298v2 Announce Type: replace 
Abstract: The Matrix Profile (MP), a versatile tool for time series data mining, has been shown effective in time series anomaly detection (TSAD). This paper"
cs.LG,cs.LG_187,DROP: Distributional and Regular Optimism and Pessimism for Reinforcement Learning,https://arxiv.org/abs/2410.17473,"arXiv:2410.17473v2 Announce Type: replace 
Abstract: In reinforcement learning (RL), temporal difference (TD) error is known to be related to the firing rate of dopamine neurons. It has been observed "
cs.LG,cs.LG_188,Pseudo-Probability Unlearning: Efficient and Privacy-Preserving Machine Unlearning,https://arxiv.org/abs/2411.02622,"arXiv:2411.02622v2 Announce Type: replace 
Abstract: Machine unlearning, enabling a trained model to forget specific data, is crucial for addressing erroneous data and adhering to privacy regulations "
cs.LG,cs.LG_189,Path Regularization: A Near-Complete and Optimal Nonasymptotic Generalization Theory for Multilayer Neural Networks and Double Descent Phenomenon,https://arxiv.org/abs/2503.02129,"arXiv:2503.02129v2 Announce Type: replace 
Abstract: Path regularization has shown to be a very effective regularization to train neural networks, leading to a better generalization property than comm"
cs.LG,cs.LG_190,SSPINNpose: A Self-Supervised PINN for Inertial Pose and Dynamics Estimation,https://arxiv.org/abs/2506.11786,"arXiv:2506.11786v2 Announce Type: replace 
Abstract: Accurate real-time estimation of human movement dynamics, including internal joint moments and muscle forces, is essential for applications in clin"
cs.LG,cs.LG_191,Inference-Time Scaling of Diffusion Language Models via Trajectory Refinement,https://arxiv.org/abs/2507.08390,"arXiv:2507.08390v4 Announce Type: replace 
Abstract: Discrete diffusion models have recently emerged as strong alternatives to autoregressive language models, matching their performance through large-"
cs.LG,cs.LG_192,Negative Binomial Variational Autoencoders for Overdispersed Latent Modeling,https://arxiv.org/abs/2508.05423,"arXiv:2508.05423v2 Announce Type: replace 
Abstract: Although artificial neural networks are often described as brain-inspired, their representations typically rely on continuous activations, such as "
cs.LG,cs.LG_193,Quantitative Estimation of Target Task Performance from Unsupervised Pretext Task in Semi/Self-Supervised Learning,https://arxiv.org/abs/2508.07299,"arXiv:2508.07299v2 Announce Type: replace 
Abstract: The effectiveness of unlabeled data in Semi/Self-Supervised Learning (SSL) depends on appropriate assumptions for specific scenarios, thereby enabl"
cs.LG,cs.LG_194,LNN-PINN: A Unified Physics-Only Training Framework with Liquid Residual Blocks,https://arxiv.org/abs/2508.08935,"arXiv:2508.08935v4 Announce Type: replace 
Abstract: Physics-informed neural networks (PINNs) have attracted considerable attention for their ability to integrate partial differential equation priors "
cs.LG,cs.LG_195,In-Context Decision Making for Optimizing Complex AutoML Pipelines,https://arxiv.org/abs/2508.13657,"arXiv:2508.13657v2 Announce Type: replace 
Abstract: Combined Algorithm Selection and Hyperparameter Optimization (CASH) has been fundamental to traditional AutoML systems. However, with the advanceme"
cs.LG,cs.LG_196,Physics-Informed Spectral Modeling for Hyperspectral Imaging,https://arxiv.org/abs/2508.21618,"arXiv:2508.21618v2 Announce Type: replace 
Abstract: We present PhISM, a physics-informed deep learning architecture that learns without supervision to explicitly disentangle hyperspectral observation"
cs.LG,cs.LG_197,LoFT: Parameter-Efficient Fine-Tuning for Long-tailed Semi-Supervised Learning in Open-World Scenarios,https://arxiv.org/abs/2509.09926,"arXiv:2509.09926v5 Announce Type: replace 
Abstract: Long-tailed semi-supervised learning (LTSSL) presents a formidable challenge where models must overcome the scarcity of tail samples while mitigati"
cs.LG,cs.LG_198,MDP modeling for multi-stage stochastic programs,https://arxiv.org/abs/2509.22981,"arXiv:2509.22981v2 Announce Type: replace 
Abstract: We study a class of multi-stage stochastic programs, which incorporate modeling features from Markov decision processes (MDPs). This class includes"
cs.LG,cs.LG_199,Entropy After </Think> for reasoning model early exiting,https://arxiv.org/abs/2509.26522,"arXiv:2509.26522v3 Announce Type: replace 
Abstract: Reasoning LLMs show improved performance with longer chains of thought. However, recent work has highlighted their tendency to overthink, continuin"
cs.LG,cs.LG_200,Bayesian E(3)-Equivariant Interatomic Potential with Iterative Restratification of Many-body Message Passing,https://arxiv.org/abs/2510.03046,"arXiv:2510.03046v2 Announce Type: replace 
Abstract: Machine learning potentials (MLPs) have become essential for large-scale atomistic simulations, enabling ab initio-level accuracy with computationa"
cs.LG,cs.LG_201,ECLipsE-Gen-Local: Efficient Compositional Local Lipschitz Estimates for Deep Neural Networks,https://arxiv.org/abs/2510.05261,"arXiv:2510.05261v2 Announce Type: replace 
Abstract: The Lipschitz constant is a key measure for certifying the robustness of neural networks to input perturbations. However, computing the exact const"
cs.LG,cs.LG_202,Approximate Replicability in Learning,https://arxiv.org/abs/2510.20200,"arXiv:2510.20200v2 Announce Type: replace 
Abstract: Replicability, introduced by (Impagliazzo et al. STOC '22), is the notion that algorithms should remain stable under a resampling of their inputs ("
cs.LG,cs.LG_203,Alternatives to the Laplacian for Scalable Spectral Clustering with Group Fairness Constraints,https://arxiv.org/abs/2510.20220,"arXiv:2510.20220v3 Announce Type: replace 
Abstract: Recent research has focused on mitigating algorithmic bias in clustering by incorporating fairness constraints into algorithmic design. Notions suc"
cs.LG,cs.LG_204,GIFT: Group-Relative Implicit Fine-Tuning Integrates GRPO with DPO and UNA,https://arxiv.org/abs/2510.23868,"arXiv:2510.23868v4 Announce Type: replace 
Abstract: This paper proposes \textit{Group-relative Implicit Fine-Tuning (GIFT)}, a reinforcement learning framework for aligning large language models (LLM"
cs.LG,cs.LG_205,LoRA-DA: Data-Aware Initialization for Low-Rank Adaptation via Asymptotic Analysis,https://arxiv.org/abs/2510.24561,"arXiv:2510.24561v2 Announce Type: replace 
Abstract: LoRA has become a widely adopted method for PEFT, and its initialization methods have attracted increasing attention. However, existing methods hav"
cs.LG,cs.LG_206,Nirvana: A Specialized Generalist Model With Task-Aware Memory Mechanism,https://arxiv.org/abs/2510.26083,"arXiv:2510.26083v2 Announce Type: replace 
Abstract: Large Language Models (LLMs) excel at general language tasks but struggle in specialized domains. Specialized Generalist Models (SGMs) address this"
cs.LG,cs.LG_207,Tensor-Efficient High-Dimensional Q-learning,https://arxiv.org/abs/2511.03595,"arXiv:2511.03595v2 Announce Type: replace 
Abstract: High-dimensional reinforcement learning(RL) faces challenges with complex calculations and low sample efficiency in large state-action spaces. Q-le"
cs.LG,cs.LG_208,Adaptive Symmetrization of the KL Divergence,https://arxiv.org/abs/2511.11159,"arXiv:2511.11159v2 Announce Type: replace 
Abstract: Many tasks in machine learning can be described as or reduced to learning a probability distribution given a finite set of samples. A common approa"
cs.LG,cs.LG_209,SpecQuant: Spectral Decomposition and Adaptive Truncation for Ultra-Low-Bit LLMs Quantization,https://arxiv.org/abs/2511.11663,"arXiv:2511.11663v2 Announce Type: replace 
Abstract: The emergence of accurate open large language models (LLMs) has sparked a push for advanced quantization techniques to enable efficient deployment "
cs.LG,cs.LG_210,TREASURE: The Visa Payment Foundation Model for High-Volume Transaction Understanding,https://arxiv.org/abs/2511.19693,"arXiv:2511.19693v3 Announce Type: replace 
Abstract: Payment networks form the backbone of modern commerce, generating high volumes of transaction records from daily activities. Properly modeling this"
cs.LG,cs.LG_211,CHiQPM: Calibrated Hierarchical Interpretable Image Classification,https://arxiv.org/abs/2511.20779,"arXiv:2511.20779v2 Announce Type: replace 
Abstract: Globally interpretable models are a promising approach for trustworthy AI in safety-critical domains. Alongside global explanations, detailed local"
cs.LG,cs.LG_212,Adaptive Replay Buffer for Offline-to-Online Reinforcement Learning,https://arxiv.org/abs/2512.10510,"arXiv:2512.10510v2 Announce Type: replace 
Abstract: Offline-to-Online Reinforcement Learning (O2O RL) faces a critical dilemma in balancing the use of a fixed offline dataset with newly collected onl"
cs.LG,cs.LG_213,Machine Unlearning in the Era of Quantum Machine Learning: An Empirical Study,https://arxiv.org/abs/2512.19253,"arXiv:2512.19253v3 Announce Type: replace 
Abstract: We present the first empirical study of machine unlearning (MU) in hybrid quantum-classical neural networks. While MU has been extensively explored"
cs.LG,cs.LG_214,Replacing Tunable Parameters in Weather and Climate Models with State-Dependent Functions using Reinforcement Learning,https://arxiv.org/abs/2601.04268,"arXiv:2601.04268v2 Announce Type: replace 
Abstract: Weather and climate models rely on parametrisations to represent unresolved sub-grid processes. Traditional schemes rely on fixed coefficients that"
cs.LG,cs.LG_215,Low-Rank Key Value Attention,https://arxiv.org/abs/2601.11471,"arXiv:2601.11471v3 Announce Type: replace 
Abstract: The key-value (KV) cache is a primary memory bottleneck in Transformers. We propose Low-Rank Key-Value (LRKV) attention, which reduces KV cache mem"
cs.LG,cs.LG_216,BadImplant: Injection-based Multi-Targeted Graph Backdoor Attack,https://arxiv.org/abs/2601.15474,"arXiv:2601.15474v2 Announce Type: replace 
Abstract: Graph neural network (GNN) have demonstrated exceptional performance in solving critical problems across diverse domains yet remain susceptible to "
cs.LG,cs.LG_217,Explainable AI to Improve Machine Learning Reliability for Industrial Cyber-Physical Systems,https://arxiv.org/abs/2601.16074,"arXiv:2601.16074v2 Announce Type: replace 
Abstract: Industrial Cyber-Physical Systems (CPS) are sensitive infrastructure from both safety and economics perspectives, making their reliability critical"
cs.LG,cs.LG_218,SPICE: Submodular Penalized Information-Conflict Selection for Efficient Large Language Model Training,https://arxiv.org/abs/2601.23155,"arXiv:2601.23155v2 Announce Type: replace 
Abstract: Information-based data selection for instruction tuning is compelling: maximizing the log-determinant of the Fisher information yields a monotone s"
cs.LG,cs.LG_219,Infusion: Shaping Model Behavior by Editing Training Data via Influence Functions,https://arxiv.org/abs/2602.09987,"arXiv:2602.09987v5 Announce Type: replace 
Abstract: Influence functions are commonly used to attribute model behavior to training documents. We explore the reverse: crafting training data that induce"
cs.LG,cs.LG_220,Zatom-1: A Multimodal Flow Foundation Model for 3D Molecules and Materials,https://arxiv.org/abs/2602.22251,"arXiv:2602.22251v3 Announce Type: replace 
Abstract: General-purpose 3D chemical modeling encompasses molecules and materials, requiring both generative and predictive capabilities. However, most exis"
cs.LG,cs.LG_221,LUMINA: Foundation Models for Topology Transferable ACOPF,https://arxiv.org/abs/2603.04300,"arXiv:2603.04300v2 Announce Type: replace 
Abstract: Foundation models in general promise to accelerate scientific computation by learning reusable representations across problem instances, yet constr"
cs.LG,cs.LG_222,Interventional Time Series Priors for Causal Foundation Models,https://arxiv.org/abs/2603.11090,"arXiv:2603.11090v2 Announce Type: replace 
Abstract: Prior-data fitted networks (PFNs) have emerged as powerful foundation models for tabular causal inference, yet their extension to time series remai"
cs.LG,cs.LG_223,EvoFlows: Evolutionary Edit-Based Flow-Matching for Protein Engineering,https://arxiv.org/abs/2603.11703,"arXiv:2603.11703v2 Announce Type: replace 
Abstract: We introduce EvoFlows, a variable-length protein sequence-to-sequence modeling approach designed for protein engineering. Existing protein language"
cs.LG,cs.LG_224,Shapes are not enough: CONSERVAttack and its use for finding vulnerabilities and uncertainties in machine learning applications,https://arxiv.org/abs/2603.13970,"arXiv:2603.13970v2 Announce Type: replace 
Abstract: In High Energy Physics, as in many other fields of science, the application of machine learning techniques has been crucial in advancing our unders"
cs.LG,cs.LG_225,CRPS-Optimal Binning for Univariate Conformal Regression,https://arxiv.org/abs/2603.22000,"arXiv:2603.22000v2 Announce Type: replace 
Abstract: We propose a method for non-parametric conditional distribution estimation based on partitioning covariate-sorted observations into contiguous bins"
cs.LG,cs.LG_226,MR-ImagenTime: Multi-Resolution Time Series Generation through Dual Image Representations,https://arxiv.org/abs/2603.28253,"arXiv:2603.28253v2 Announce Type: replace 
Abstract: Time series forecasting is vital across many domains, yet existing models struggle with fixed-length inputs and inadequate multi-scale modeling. We"
cs.LG,cs.LG_227,Toward Personalized Darts Training: A Data-Driven Framework Based on Skeleton-Based Biomechanical Analysis and Motion Modeling,https://arxiv.org/abs/2604.01130,"arXiv:2604.01130v3 Announce Type: replace 
Abstract: As sports training becomes more data-driven, traditional dart coaching based mainly on experience and visual observation is increasingly inadequate"
cs.LG,cs.LG_228,Matrix Profile for Time-Series Anomaly Detection: A Reproducible Open-Source Benchmark on TSB-AD,https://arxiv.org/abs/2604.02445,"arXiv:2604.02445v2 Announce Type: replace 
Abstract: Matrix Profile (MP) methods are an interpretable and scalable family of distance-based methods for time-series anomaly detection, but strong benchm"
cs.LG,cs.LG_229,Self-Distilled RLVR,https://arxiv.org/abs/2604.03128,"arXiv:2604.03128v2 Announce Type: replace 
Abstract: On-policy distillation (OPD) has become a popular training paradigm in the LLM community. This paradigm selects a larger model as the teacher to pr"
cs.LG,cs.LG_230,"NativeTernary: A Self-Delimiting Binary Encoding with Unary Run-Length Hierarchy Markers for Ternary Neural Network Weights, Structured Data, and General Computing Infrastructure",https://arxiv.org/abs/2604.03336,"arXiv:2604.03336v2 Announce Type: replace 
Abstract: BitNet b1.58 (Ma et al., 2024) demonstrates that large language models can operate entirely on ternary weights {-1, 0, +1}, yet no native binary wi"
